contig	cds	domain	domain_descriptions	start	end	score
NEBC14576	2647537_-1_2646296	I-LlaI	EnzType:homing endonuclease ; RecSeq:CACATCCATAACCATATCATTTTT; Org#: 1686; OrgName: Lactococcus lactis; Source: M. Gasson; GenBank:X89922; SeqLength:599; ProteinId:CAA61996.1; UniProt:P0A3U1; GI:1296829	2647522	2646698	112.3
NEBC14576	2712953_1_2713273	C.EcoO109I	EnzType:control protein; RecSeq:CTAAGNNNNNCTTAG; Org#: 1252; OrgName: Escherichia coli H709c; Source: I. Orskov; GenBank:AF157599; SeqLength:101; ProteinId:AAF06963.1; UniProt:Q9RPJ4; GI:6318606	2712974	2713264	98.1
NEBC14576	2713524_1_2713784	NsoJS138I	EnzType:Type II restriction enzyme; RecSeq:CAGCTG; Org#: 10391; OrgName: Niabella soli DSM 19437; Source: DSM 19437; GenBank:CP007035; SeqLength:237	2713527	2713754	21.7
NEBC14576	3003691_1_3004500	SstE37III	(RM.SstE37III) EnzType:Type IIG restriction enzyme/methyltransferase; RecSeq:CTGAAG; Org#: 5775; OrgName: Sagittula stellata E-37; Source: M.A. Moran; GenBank:AAYA01000014; SeqLength:1182; Locus:SSE37_10218; ProteinId:EBA06623.1; UniProt:A3K8E4; GI:126707560	3003754	3004281	14.5
NEBC14576	3293224_-1_3291212	SauNewI	EnzType:Type IV methyl-directed restriction enzyme; RecSeq:SCNGS; Org#: 4806; OrgName: Staphylococcus aureus subsp. aureus str. Newman; Source: T. Baba; GenBank:AP009351; SeqLength:953; Locus:NWMN_2386; ProteinId:BAF68658.1; UniProt:A0A0H3KIS6; GI:150375398	3292459	3292028	24.2
NEBC14576	3315700_1_3315924	S.Aho11636I	EnzType:Type I specificity subunit; RecSeq:CAGNNNNNGTGG; Org#: 32454; OrgName: Actinomyces howellii NCTC11636; Source: P. Informatics; GenBank:LR134350; SeqLength:405; Locus:NCTC11636_00594; ProteinId:VEG26578.1; UniProt:A0A3S4SLV0	3315715	3315921	14.7
NEBC14576	3393022_-1_3392729	I-Bth0305I	EnzType:homing endonuclease ; RecSeq:ATGTAAACTCACGCTTCGGTGATCCAAACGTGACAACTG; Org#: 7980; OrgName: Bacillus thuringiensis bacteriophage 0305phi8-36; Source: P. Serwer; GenBank:EF583821; SeqLength:266; Locus:0305phi8-36p029; ProteinId:ABS83813.1; UniProt:A7KV39; GI:154622933	3393022	3392759	15.7
NEBC14576	3418761_-1_3418213	C.AhdI	EnzType:control protein; RecSeq:ACTCATAGTCCGTGGACTTATCGA; Org#: 107; OrgName: Aeromonas hydrophila; Source: NEB 724; GenBank:CP050994; SeqLength:74; Locus:HFP99_10565; ProteinId:QIY87049.1; UniProt:Q7X0F0	3418755	3418552	37.4
NEBC14576	3435587_-1_3432906	CjeFIV	EnzType:Type I restriction enzyme; RecSeq:GCANNNNNRTTA; Org#: 3414; OrgName: Campylobacter jejuni strain 81-176; Source: R.E. Mandrell; GenBank:CP000538; SeqLength:1031; Locus:CJJ81176_1534; ProteinId:EAQ72833.1; UniProt:A0A0H3PIG5	3435503	3433734	88.6
NEBC14576	3439632_-1_3438490	S.SenLG25II	EnzType:Type I specificity subunit; RecSeq:GACNNNNNNRTTC; Org#: 35567; OrgName: Salmonella enterica subsp. enterica serovar Muenchen LG25; Source: T.D. Tran; GenBank:CP045058; SeqLength:434; Locus:SMLG25_01645; ProteinId:QGH10450.1	3439632	3438493	236.9
NEBC14576	3440078_-1_3439632	M.Aba858I	EnzType:Type I methyltransferase; RecSeq:TAGNNNNNNRTGG; Org#: 18340; OrgName: Acinetobacter baumannii XH858; Source: Y. Feng; GenBank:CP014528; SeqLength:761; Locus:AZE33_06615; ProteinId:AMN00860.1; GI:100219049	3440078	3439635	281.6
NEBC14576	3457642_1_3457851	C.BclI	EnzType:control protein; RecSeq:ACTTAAAGTCTGTAGACTTATAGC; Org#: 228; OrgName: Bacillus caldolyticus; Source: A. Atkinson; GenBank:CP025075; SeqLength:77; Locus:CWI35_18055; ProteinId:AUI38376.1; UniProt:E5LGB7	3457648	3457845	16.2
NEBC14575	41130_-1_39889	I-LlaI	EnzType:homing endonuclease ; RecSeq:CACATCCATAACCATATCATTTTT; Org#: 1686; OrgName: Lactococcus lactis; Source: M. Gasson; GenBank:X89922; SeqLength:599; ProteinId:CAA61996.1; UniProt:P0A3U1; GI:1296829	41118	40291	112.5
NEBC14575	51299_1_52126	S.Vna16374I	EnzType:Type I specificity subunit; RecSeq:TTAGNNNNNNCTTG; Org#: 19660; OrgName: Vibrio natriegens CCUG 16374; Source: M.T. Weinstock; GenBank:CP016351; SeqLength:458; Locus:BA894_04805; ProteinId:ANQ25805.1; UniProt:A0A1B1EAW2; GI:104239139	51785	52117	14.9
NEBC14575	99956_-1_99684	M.Kpn2kI	EnzType:Type II methyltransferase; RecSeq:CCNGG; Org#: 1629; OrgName: Klebsiella pneumoniae 2k; Source: A.S. Solonin; GenBank:AF300473; SeqLength:379; ProteinId:AAG38101.1; UniProt:Q71SG9; GI:11559818	99872	99693	18.0
NEBC14575	121236_1_122147	M.BceSVII	EnzType:Type II methyltransferase; RecSeq:AB; Org#: 244; OrgName: Bacillus cereus ATCC 10987; Source: ATCC 10987; GenBank:AE017194; SeqLength:413; Locus:BCE_0392; ProteinId:AAS39328.1; UniProt:Q73EG6; GI:42735389	121329	121670	14.9
NEBC14575	127539_1_129086	M.AbaB8342I	EnzType:Type I methyltransferase; RecSeq:TTCANNNNNNTCC; Org#: 16880; OrgName: Acinetobacter baumannii B8342; Source: S. Vijaykumar; GenBank:CP021342; SeqLength:515; Locus:AB895_0917; ProteinId:KMV05495.1	127539	129083	1116.3
NEBC14575	129083_1_130312	S.Ahe12129I	EnzType:Type I specificity subunit; RecSeq:TTGANNNNNNTCG; Org#: 32304; OrgName: Atlantibacter hermannii NCTC12129; Source: P. Informatics; GenBank:LR134136; SeqLength:471; Locus:NCTC12129_00783; ProteinId:VDZ71715.1; UniProt:A0A447LJ47	129083	129778	248.2
NEBC14575	129083_1_130312	S.Cam165I	EnzType:Type I specificity subunit; RecSeq:TTCANNNNNNTTC; Org#: 18106; OrgName: Citrobacter amalonaticus FDAARGOS_165; Source: B. Goldberg; GenBank:CP014070; SeqLength:402; Locus:AL524_08170; ProteinId:AMG53067.1	129098	130309	158.0
NEBC14575	131494_1_134730	CjeFIV	EnzType:Type I restriction enzyme; RecSeq:GCANNNNNRTTA; Org#: 3414; OrgName: Campylobacter jejuni strain 81-176; Source: R.E. Mandrell; GenBank:CP000538; SeqLength:1031; Locus:CJJ81176_1534; ProteinId:EAQ72833.1; UniProt:A0A0H3PIG5	131554	132450	281.5
NEBC14575	131494_1_134730	CjeFIV	EnzType:Type I restriction enzyme; RecSeq:GCANNNNNRTTA; Org#: 3414; OrgName: Campylobacter jejuni strain 81-176; Source: R.E. Mandrell; GenBank:CP000538; SeqLength:1031; Locus:CJJ81176_1534; ProteinId:EAQ72833.1; UniProt:A0A0H3PIG5	132427	134724	973.9
NEBC14575	148345_-1_147518	S.Vna16374I	EnzType:Type I specificity subunit; RecSeq:TTAGNNNNNNCTTG; Org#: 19660; OrgName: Vibrio natriegens CCUG 16374; Source: M.T. Weinstock; GenBank:CP016351; SeqLength:458; Locus:BA894_04805; ProteinId:ANQ25805.1; UniProt:A0A1B1EAW2; GI:104239139	147859	147527	14.9
NEBC14575	159895_1_161136	I-LlaI	EnzType:homing endonuclease ; RecSeq:CACATCCATAACCATATCATTTTT; Org#: 1686; OrgName: Lactococcus lactis; Source: M. Gasson; GenBank:X89922; SeqLength:599; ProteinId:CAA61996.1; UniProt:P0A3U1; GI:1296829	159907	160734	112.5
HQ636109	170_1_385	C.MunI	EnzType:control protein; RecSeq:GCTTATAGTCCGTTGTTTTTAAAC; Org#: 1824; OrgName: Mycoplasma species; Source: A. Janulaitis; GenBank:X76192; SeqLength:74; ProteinId:CAA53787.1; UniProt:P43640; GI:431929	173	382	48.4
HQ636109	407_1_1552	BspHI	EnzType:Type II restriction enzyme; RecSeq:TCATGA; Org#: 398; OrgName: Bacillus species H; Source: NEB 394; GenBank:CP055283; SeqLength:381; Locus:HUK62_17155; ProteinId:QKY92181.1; UniProt:A0A7H8SKI6	407	1549	839.8
HQ636109	2771_-1_1536	M.BspHI	EnzType:Type II methyltransferase; RecSeq:TCATGA; Org#: 398; OrgName: Bacillus species H; Source: NEB 394; GenBank:CP055283; SeqLength:411; Locus:HUK62_17160; ProteinId:QKY92182.1; UniProt:A0A7H8SLI8	2771	1539	937.5
NEBC14577	22626_-1_22267	C.AhdI	EnzType:control protein; RecSeq:ACTCATAGTCCGTGGACTTATCGA; Org#: 107; OrgName: Aeromonas hydrophila; Source: NEB 724; GenBank:CP050994; SeqLength:74; Locus:HFP99_10565; ProteinId:QIY87049.1; UniProt:Q7X0F0	22620	22402	22.6
NEBC14577	47656_-1_44135	M.EfeV	EnzType:Type II methyltransferase; Org#: 5259; OrgName: Escherichia fergusonii ATCC 35469; Source: ATCC 35469; GenBank:CU928144; SeqLength:1217; Locus:EFER_p0025; ProteinId:CAQ86937.1; UniProt:B7L3T0	47656	44138	1326.9
NEBC14574	1216_1_1434	C.MunI	EnzType:control protein; RecSeq:GCTTATAGTCCGTTGTTTTTAAAC; Org#: 1824; OrgName: Mycoplasma species; Source: A. Janulaitis; GenBank:X76192; SeqLength:74; ProteinId:CAA53787.1; UniProt:P43640; GI:431929	1225	1431	48.3
NEBC14574	1441_1_2601	BspHI	EnzType:Type II restriction enzyme; RecSeq:TCATGA; Org#: 398; OrgName: Bacillus species H; Source: NEB 394; GenBank:CP055283; SeqLength:381; Locus:HUK62_17155; ProteinId:QKY92181.1; UniProt:A0A7H8SKI6	1456	2598	838.5
NEBC14574	3820_-1_2585	M.BspHI	EnzType:Type II methyltransferase; RecSeq:TCATGA; Org#: 398; OrgName: Bacillus species H; Source: NEB 394; GenBank:CP055283; SeqLength:411; Locus:HUK62_17160; ProteinId:QKY92182.1; UniProt:A0A7H8SLI8	3820	2588	937.5
AF431889	601_1_2427	M.EacI	EnzType:Type II methyltransferase; RecSeq:GGATC; Org#: 3501; OrgName: Eubacterium acidaminophilum; Source: DSM 3953; GenBank:CP007452; SeqLength:642	601	2424	847.3
AF431889	2474_1_4150	EacI	EnzType:Type II restriction enzyme; RecSeq:GGATC; Org#: 3501; OrgName: Eubacterium acidaminophilum; Source: DSM 3953; GenBank:CP007452; SeqLength:570; Locus:EAL2_c05620; ProteinId:AHM55864.1; UniProt:W8T290	2474	4141	387.6
AF355461	1_1_852	M.Pen113I	EnzType:Type II methyltransferase; RecSeq:GASTC; Org#: 17433; OrgName: Prevotella enoeca F0113; Source: M.E. Holder; GenBank:CP013195; SeqLength:319; Locus:AS203_03465; ProteinId:ALO49832.1; UniProt:A0A0S2KNF3; GI:953020125	10	849	406.0
AF355461	883_1_2550	Nt.BhaIII	EnzType:Type II nicking endonuclease; RecSeq:GAGTC; Org#: 284; OrgName: Bacillus halodurans C-125; Source: JCM 9153; GenBank:BA000004; SeqLength:624; ProteinId:BAB07720.1; UniProt:Q9K5T7	1024	2547	125.1
JF323044	3337_-1_3101	C.BclI	EnzType:control protein; RecSeq:ACTTAAAGTCTGTAGACTTATAGC; Org#: 228; OrgName: Bacillus caldolyticus; Source: A. Atkinson; GenBank:CP025075; SeqLength:77; Locus:CWI35_18055; ProteinId:AUI38376.1; UniProt:E5LGB7	3325	3104	36.7
JF323044	3433_1_5661	M.BslI	EnzType:Type II methyltransferase; RecSeq:CCNNNNNNNGG; Org#: 534; OrgName: Bacillus species; Source: NEB 606; GenBank:AF135191; SeqLength:912; ProteinId:AAF32529.1; UniProt:Q9LAI2; GI:6958314	4267	5637	322.3
NEBC14562	275295_-1_274873	M.Bhi13200I	EnzType:Type I methyltransferase; RecSeq:GAANNNNNNGTTG; Org#: 25623; OrgName: Bordetella hinzii NCTC13200; Source: NCTC 13200; GenBank:LT906461; SeqLength:642	275151	274900	14.0
NEBC14562	387798_1_388481	M.NmaPhiCh1I	EnzType:Type II methyltransferase; RecSeq:GATC; Org#: 1836; OrgName: Natrialba magadii phage PhiCh1; Source: A. Witte; GenBank:AF440695; SeqLength:419; ProteinId:AAF04014.1; UniProt:Q9T1P2; GI:6118090	387960	388313	14.2
NEBC14562	435215_1_437230	ScoA3I	EnzType:Type IV methyl-directed restriction enzyme; Org#: 2434; OrgName: Streptomyces coelicolor A3(2); Source: D.A. Hopwood; GenBank:AL645882; SeqLength:945; ProteinId:CAB65593.1; UniProt:Q9RD88; GI:6689196	436469	436951	27.5
NEBC14562	455195_1_456535	ScoA3I	EnzType:Type IV methyl-directed restriction enzyme; Org#: 2434; OrgName: Streptomyces coelicolor A3(2); Source: D.A. Hopwood; GenBank:AL645882; SeqLength:945; ProteinId:CAB65593.1; UniProt:Q9RD88; GI:6689196	455840	456292	28.0
NEBC14562	628245_1_630350	M.BspEI	EnzType:Type II methyltransferase; RecSeq:TCCGGA; Org#: 532; OrgName: Bacillus species; Source: NEB 553; GenBank:HQ636103; SeqLength:314; ProteinId:ADR72989.1; UniProt:E5Q8T4; GI:313667091	629991	630236	14.1
NEBC14562	739894_1_740313	M.CspCP1I	EnzType:Type I methyltransferase; RecSeq:CAAYNNNNNCTAY; Org#: 17893; OrgName: Carnobacterium species CP1; Source: J. Chen; GenBank:CP010796; SeqLength:531; Locus:NY10_1635; ProteinId:ALV22234.1; UniProt:A0A0U3P092; GI:971184568	739915	740166	18.3
NEBC14562	768084_-1_767527	C.BclI	EnzType:control protein; RecSeq:ACTTAAAGTCTGTAGACTTATAGC; Org#: 228; OrgName: Bacillus caldolyticus; Source: A. Atkinson; GenBank:CP025075; SeqLength:77; Locus:CWI35_18055; ProteinId:AUI38376.1; UniProt:E5LGB7	768069	767863	22.7
NEBC14562	904887_-1_904525	M.SmaUMH12I	EnzType:Type I methyltransferase; RecSeq:GTAANNNNNNCTG; Org#: 25338; OrgName: Serratia marcescens UMH12; Source: M.T. Anderson; GenBank:CP018930; SeqLength:820; Locus:BVG84_24155; ProteinId:ASM33902.1	904881	904579	15.7
NEBC14562	918665_-1_918330	Lmo370I	(RM.Lmo370I) EnzType:Type IIG restriction enzyme/methyltransferase; RecSeq:AGCGCCG; Org#: 16419; OrgName: Luteipulveratus mongoliensis MN07-A0370; Source: NBRC 105296; GenBank:CP011112; SeqLength:1183; Locus:VV02_01670; ProteinId:AKU14875.1; UniProt:A0A0K1JE61; GI:909832084	918650	918372	12.8
NEBC14562	930098_1_930952	M.BbrUIII	EnzType:Type II methyltransferase; RecSeq:CTGCAG; Org#: 5698; OrgName: Bifidobacterium breve UCC2003; Source: D. van Sinderen; GenBank:CP000303; SeqLength:467; Locus:Bbr_1119; ProteinId:ABE95797.1; GI:339479329	930356	930832	29.5
NEBC14562	1089193_1_1089777	C.BclI	EnzType:control protein; RecSeq:ACTTAAAGTCTGTAGACTTATAGC; Org#: 228; OrgName: Bacillus caldolyticus; Source: A. Atkinson; GenBank:CP025075; SeqLength:77; Locus:CWI35_18055; ProteinId:AUI38376.1; UniProt:E5LGB7	1089211	1089432	18.2
NEBC14562	1165415_1_1166017	C.SptAI	EnzType:control protein; Org#: 4060; OrgName: Salmonella enterica subsp. enterica serovar Paratyphi A str. ATCC 9150; Source: ATCC 9150; GenBank:CP000026; SeqLength:78; Locus:SPA4290; ProteinId:AAV80023.1; UniProt:A0A0H2WVK7; GI:56130517	1165445	1165666	19.7
NEBC14562	1198626_-1_1197991	V.MthTI	EnzType:Type II nicking endonuclease; Org#: 1707; OrgName: Methanobacterium thermoformicicum THF; Source: DSM 3848; GenBank:X68366; SeqLength:221; ProteinId:CAA48433.1; UniProt:P29588; GI:809723	1198623	1197994	70.3
NEBC14562	1209573_-1_1209316	M1.Ssu4109I	EnzType:Type II methyltransferase; RecSeq:GATC; Org#: 3270; OrgName: Streptococcus suis strain 89-4109-1; Source: T. Sekizaki; GenBank:AB058945; SeqLength:276; ProteinId:BAB63434.1; UniProt:Q93R75; GI:15281344	1209573	1209364	16.1
NEBC14562	1321090_-1_1320620	C.BclI	EnzType:control protein; RecSeq:ACTTAAAGTCTGTAGACTTATAGC; Org#: 228; OrgName: Bacillus caldolyticus; Source: A. Atkinson; GenBank:CP025075; SeqLength:77; Locus:CWI35_18055; ProteinId:AUI38376.1; UniProt:E5LGB7	1321087	1320905	21.2
NEBC14562	1479146_-1_1476513	EcoKMcrBC	(EcoKMcrB) EnzType:Type IV methyl-directed restriction enzyme; Org#: 1260; OrgName: Escherichia coli K-12 substr. MG1655; Source: F.R. Blattner; GenBank:U00096; SeqLength:459; Locus:b4346; ProteinId:AAC77302.2; UniProt:P15005	1477340	1476999	14.4
NEBC14562	1632012_-1_1631437	C.SptAI	EnzType:control protein; Org#: 4060; OrgName: Salmonella enterica subsp. enterica serovar Paratyphi A str. ATCC 9150; Source: ATCC 9150; GenBank:CP000026; SeqLength:78; Locus:SPA4290; ProteinId:AAV80023.1; UniProt:A0A0H2WVK7; GI:56130517	1632000	1631785	20.4
NEBC14562	1652899_-1_1652354	C.BclI	EnzType:control protein; RecSeq:ACTTAAAGTCTGTAGACTTATAGC; Org#: 228; OrgName: Bacillus caldolyticus; Source: A. Atkinson; GenBank:CP025075; SeqLength:77; Locus:CWI35_18055; ProteinId:AUI38376.1; UniProt:E5LGB7	1652899	1652687	26.5
NEBC14562	1747918_-1_1746530	ScoA3I	EnzType:Type IV methyl-directed restriction enzyme; Org#: 2434; OrgName: Streptomyces coelicolor A3(2); Source: D.A. Hopwood; GenBank:AL645882; SeqLength:945; ProteinId:CAB65593.1; UniProt:Q9RD88; GI:6689196	1747237	1746833	16.2
NEBC14562	1783757_-1_1783419	M.Saf8902II	EnzType:Type II methyltransferase; RecSeq:GCWGC; Org#: 8597; OrgName: Spirochaeta africana DSM 8902; Source: DSM 8902; GenBank:CP003282; SeqLength:382; Locus:Spiaf_0875; ProteinId:AFG36966.1; UniProt:H9UHH3; GI:383106633	1783706	1783434	18.2
NEBC14562	1954321_1_1954713	M.GmeII	EnzType:Type III methyltransferase; RecSeq:TCCAGG; Org#: 3486; OrgName: Geobacter metallireducens GS-15; Source: ATCC 53774; GenBank:CP000148; SeqLength:520; Locus:Gmet_0676; ProteinId:ABB30918.1; UniProt:Q39XV6; GI:78193151	1954336	1954620	16.6
NEBC14562	2118091_-1_2116178	I-PcuVI	EnzType:homing endonuclease ; Org#: 13235; OrgName: Podospora curvicolla isolate V; Source: F. Koll; GenBank:AJ249985; SeqLength:313; ProteinId:CAB72450.1; UniProt:Q9MJQ2; GI:6967038	2118004	2117708	14.5
NEBC14562	2120144_-1_2119422	F-EcoT5IV	EnzType:homing endonuclease ; RecSeq:TAGGTACTGGACTTAAAATTCAGGTTTTGT; Org#: 4033; OrgName: Escherichia coli phage T5; Source: V.I. Tanyashin; GenBank:AY543070; SeqLength:227; Locus:T5.075; ProteinId:AAS77121.1; UniProt:Q6QGL2; GI:45774989	2119613	2119458	16.6
NEBC14562	2133610_-1_2133125	V.EcoKDcm	EnzType:Type II nicking endonuclease; Org#: 1260; OrgName: Escherichia coli K-12 substr. MG1655; Source: F.R. Blattner; GenBank:U00096; SeqLength:156; Locus:b1960; ProteinId:AAC75026.1; UniProt:P09184	2133610	2133143	293.2
NEBC14562	2135015_-1_2133594	M.Eba57Dcm	EnzType:Type II methyltransferase; RecSeq:CCWGG; Org#: 9894; OrgName: Enterobacteriaceae bacterium strain FGI 57; Source: F.O. Aylward; GenBank:CP003938; SeqLength:471; Locus:D782_1674; ProteinId:AGB77675.1; UniProt:L0M4J6; GI:440046617	2135003	2133597	858.5
NEBC14562	2334322_-1_2333954	M.Osp894I	EnzType:Type I methyltransferase; RecSeq:GAGNNNNNNGATG; Org#: 16428; OrgName: Ottowia species oral taxon 894 W10237; Source: M.E. Holder; GenBank:CP012073; SeqLength:614; Locus:ADJ79_12315; ProteinId:AKU67808.1; UniProt:A0A0K1NFZ5; GI:913016853	2334256	2333957	14.1
NEBC14562	2411646_1_2412119	M.Csp16704III	EnzType:Type II methyltransferase; RecSeq:GANTC; Org#: 14642; OrgName: Campylobacter species RM16704; Source: W.G. Miller; GenBank:CP007769; SeqLength:359; Locus:CAQ16704_0101; ProteinId:AJC85616.1; UniProt:A0A0A8GV02; GI:744807674	2411727	2412005	17.5
NEBC14562	2478632_1_2479201	S.EcoS133II	EnzType:Type I specificity subunit; RecSeq:GATANNNNNNTAG; Org#: 35522; OrgName: Escherichia coli MSHS 133; Source: I. Desloges; GenBank:CP041304; SeqLength:465; Locus:FK544_21820; ProteinId:QDJ63674.1	2478914	2479180	16.4
NEBC14562	2489293_1_2491050	ScoA3I	EnzType:Type IV methyl-directed restriction enzyme; Org#: 2434; OrgName: Streptomyces coelicolor A3(2); Source: D.A. Hopwood; GenBank:AL645882; SeqLength:945; ProteinId:CAB65593.1; UniProt:Q9RD88; GI:6689196	2489305	2490396	59.3
NEBC14562	2606672_-1_2605572	M.XamI	EnzType:Type II methyltransferase; RecSeq:GTCGAC; Org#: 3057; OrgName: Xanthomonas amaranthicola; Source: ATCC 11645; GenBank:U77781; SeqLength:527; ProteinId:AAD13686.1; UniProt:P96188; GI:1688235	2606207	2605791	22.0
NEBC14562	2736533_1_2737381	M1.BsuMI	EnzType:Type II methyltransferase; RecSeq:CTCGAG; Org#: 845; OrgName: Bacillus subtilis 168; Source: A. Danchin; GenBank:CP010052; SeqLength:427; Locus:QU35_03505; ProteinId:AIY91896.1; GI:728883501	2737148	2737372	14.0
NEBC14562	2779851_-1_2779114	M.CviQIII	EnzType:Type II methyltransferase; RecSeq:TCGA; Org#: 994; OrgName: Chlorella virus NY-2A; Source: J.L. Van Etten; GenBank:DQ491002; SeqLength:368; Locus:NY2A_B016L; ProteinId:ABT14415.1; UniProt:O37396; GI:155122547	2779749	2779237	17.0
NEBC14562	2779851_-1_2779114	M.XamI	EnzType:Type II methyltransferase; RecSeq:GTCGAC; Org#: 3057; OrgName: Xanthomonas amaranthicola; Source: ATCC 11645; GenBank:U77781; SeqLength:527; ProteinId:AAD13686.1; UniProt:P96188; GI:1688235	2779752	2779459	21.4
NEBC14562	2779982_1_2781313	SauNewI	EnzType:Type IV methyl-directed restriction enzyme; RecSeq:SCNGS; Org#: 4806; OrgName: Staphylococcus aureus subsp. aureus str. Newman; Source: T. Baba; GenBank:AP009351; SeqLength:953; Locus:NWMN_2386; ProteinId:BAF68658.1; UniProt:A0A0H3KIS6; GI:150375398	2780702	2781058	34.2
NEBC14562	2799713_-1_2797128	EcoKMcrBC	(EcoKMcrB) EnzType:Type IV methyl-directed restriction enzyme; Org#: 1260; OrgName: Escherichia coli K-12 substr. MG1655; Source: F.R. Blattner; GenBank:U00096; SeqLength:459; Locus:b4346; ProteinId:AAC77302.2; UniProt:P15005	2797913	2797581	14.7
NEBC14562	2834991_1_2835491	Esp638I	EnzType:Type II methyl-directed restriction enzyme; RecSeq:GCNGC; Org#: 4748; OrgName: Enterobacter species 638; Source: D. van der Lelie; GenBank:CP000653; SeqLength:166; Locus:Ent638_3112; ProteinId:ABP61776.1	2834991	2835488	305.6
NEBC14562	2961082_1_2961432	V.MthTI	EnzType:Type II nicking endonuclease; Org#: 1707; OrgName: Methanobacterium thermoformicicum THF; Source: DSM 3848; GenBank:X68366; SeqLength:221; ProteinId:CAA48433.1; UniProt:P29588; GI:809723	2961133	2961393	15.6
NEBC14562	3183191_-1_3182472	M.CpeAII	EnzType:Type II methyltransferase; RecSeq:GGWCC; Org#: 4467; OrgName: Clostridium perfringens ATCC 13124; Source: ATCC 13124; GenBank:CP000246; SeqLength:361; Locus:CPF_0139; ProteinId:ABG82654.1; UniProt:A0A0H2YQK2	3182777	3182484	15.0
NEBC14562	3237998_1_3239545	V.MthTI	EnzType:Type II nicking endonuclease; Org#: 1707; OrgName: Methanobacterium thermoformicicum THF; Source: DSM 3848; GenBank:X68366; SeqLength:221; ProteinId:CAA48433.1; UniProt:P29588; GI:809723	3238496	3239140	106.1
NEBC14562	3428819_1_3430933	M.NgoAXII	EnzType:Type III methyltransferase; RecSeq:GCAGA; Org#: 1851; OrgName: Neisseria gonorrhoeae FA 1090; Source: ATCC 700825; GenBank:AE004969; SeqLength:756; Locus:NGO_0641; ProteinId:AAW89368.1; UniProt:Q5F8W9; GI:59717963	3429746	3430048	14.1
NEBC14562	3443725_-1_3441743	SauNewI	EnzType:Type IV methyl-directed restriction enzyme; RecSeq:SCNGS; Org#: 4806; OrgName: Staphylococcus aureus subsp. aureus str. Newman; Source: T. Baba; GenBank:AP009351; SeqLength:953; Locus:NWMN_2386; ProteinId:BAF68658.1; UniProt:A0A0H3KIS6; GI:150375398	3442966	3442622	30.7
NEBC14562	3530468_1_3531349	M.AorT14III	EnzType:Type II methyltransferase; RecSeq:GTCGAC; Org#: 18254; OrgName: Actinomyces oris T14V; Source: M.E. Holder; GenBank:CP014232; SeqLength:590	3530867	3531172	22.3
NEBC14562	3547368_1_3548183	S.EcoDXXI	EnzType:Type I specificity subunit; RecSeq:TCANNNNNNNRTTC; Org#: 1411; OrgName: Escherichia coli pDXX1; Source: A. Piekarowicz; GenBank:X73984; SeqLength:406; ProteinId:CAA52162.1; UniProt:Q47280; GI:393411	3547899	3548177	15.3
NEBC14562	3576547_-1_3576026	S.CinAA5I	EnzType:Type I specificity subunit; RecSeq:GTANNNNNNGRTC; Org#: 23584; OrgName: Chryseobacterium indologenes AA5; Source: B. Niu; GenBank:CP018786; SeqLength:391	3576454	3576092	16.6
NEBC14562	3620226_-1_3619300	M2.BsrDI	EnzType:Type II methyltransferase; RecSeq:GCAATG; Org#: 708; OrgName: Bacillus stearothermophilus D70; Source: Z. Chen; GenBank:DQ367879; SeqLength:425; ProteinId:ABD15135.1; UniProt:A1XI25; GI:86757496	3620175	3619846	15.2
NEBC14562	3710773_1_3713166	PI-PkoI	EnzType:homing endonuclease ; RecSeq:GATTTTAGATCCCTGTACC; Org#: 2145; OrgName: Pyrococcus kodakaraensis KOD1; Source: T. Imanaka; GenBank:D29671; SeqLength:1671; ProteinId:BAA06142.2; UniProt:P77933; GI:6706000	3711019	3712155	33.2
NEBC14562	3710773_1_3713166	PI-PkoI	EnzType:homing endonuclease ; RecSeq:GATTTTAGATCCCTGTACC; Org#: 2145; OrgName: Pyrococcus kodakaraensis KOD1; Source: T. Imanaka; GenBank:D29671; SeqLength:1671; ProteinId:BAA06142.2; UniProt:P77933; GI:6706000	3712249	3713160	53.1
NEBC14562	3835430_-1_3834927	BtsI	(BtsIB) EnzType:Type II restriction enzyme; RecSeq:GCAGTG; Org#: 873; OrgName: Bacillus thermoglucosidasius; Source: NEB 1137; GenBank:DQ355163; SeqLength:328; ProteinId:ABC75876.1; UniProt:Q2I0M2; GI:85720926	3835313	3834960	14.6
NEBC14562	3835858_1_3836886	M.BbrUIII	EnzType:Type II methyltransferase; RecSeq:CTGCAG; Org#: 5698; OrgName: Bifidobacterium breve UCC2003; Source: D. van Sinderen; GenBank:CP000303; SeqLength:467; Locus:Bbr_1119; ProteinId:ABE95797.1; GI:339479329	3836407	3836736	26.9
NEBC14562	3857601_-1_3857209	S.AquV	EnzType:Type I specificity subunit; Org#: 111; OrgName: Agmenellum quadruplicatum PR-6; Source: PCC 7002; GenBank:CP000953; SeqLength:398; Locus:SYNPCC7002_C0004; ProteinId:ACB00849.1; UniProt:B1XQR8; GI:169887137	3857538	3857221	16.5
NEBC14562	3962356_-1_3961724	EcoKMcrA	EnzType:Type IV methyl-directed restriction enzyme; RecSeq:YCGR; Org#: 1260; OrgName: Escherichia coli K-12 substr. MG1655; Source: F.R. Blattner; GenBank:U00096; SeqLength:277; Locus:b1159; ProteinId:AAC74243.1; UniProt:P24200	3962086	3961739	26.7
NEBC14562	3962356_-1_3961724	ScoA3McrA	EnzType:Type IV methyl-directed restriction enzyme; Org#: 2434; OrgName: Streptomyces coelicolor A3(2); Source: D.A. Hopwood; GenBank:AL645882; SeqLength:560; ProteinId:CAB77405.1; UniProt:Q9L0M9; GI:7248325	3962350	3962066	17.0
NEBC14562	3962536_1_3963405	ScoA3McrA	EnzType:Type IV methyl-directed restriction enzyme; Org#: 2434; OrgName: Streptomyces coelicolor A3(2); Source: D.A. Hopwood; GenBank:AL645882; SeqLength:560; ProteinId:CAB77405.1; UniProt:Q9L0M9; GI:7248325	3962536	3963045	27.3
NEBC14562	3962536_1_3963405	R1.BbrUI	EnzType:Type II restriction enzyme; RecSeq:GGCGCC; Org#: 5698; OrgName: Bifidobacterium breve UCC2003; Source: D. van Sinderen; GenBank:CP000303; SeqLength:282	3962920	3963402	46.3
NEBC14562	3964877_1_3966361	M2.Sgr13350III	EnzType:Type II methyltransferase; RecSeq:GCTCTTC; Org#: 5035; OrgName: Streptomyces griseus subsp. griseus NBRC 13350; Source: NBRC 13350; GenBank:NEBC8632; SeqLength:445	3965099	3966358	195.5
NEBC14562	3966358_1_3967497	M2.BfiI	EnzType:Type II methyltransferase; RecSeq:ACTGGG; Org#: 280; OrgName: Bacillus firmus S8120; Source: A. Janulaitis; GenBank:AJ290970; SeqLength:504; ProteinId:CAC12782.1; UniProt:Q9F4D0; GI:10798462	3966406	3967206	50.7
NEBC14562	3966358_1_3967497	M.RsaI	EnzType:Type II methyltransferase; RecSeq:GTAC; Org#: 2181; OrgName: Rhodopseudomonas sphaeroides; Source: S. Kaplan; GenBank:CP020470; SeqLength:409; Locus:B6K69_04320; ProteinId:AWD20990.1	3966976	3967368	23.2
NEBC14562	4187138_1_4187371	S.PpuAA7I	EnzType:Type I specificity subunit; RecSeq:GTANNNNNNNNTCCA; Org#: 23583; OrgName: Pseudomonas putida AA7; Source: B. Niu; GenBank:CP018846; SeqLength:475	4187138	4187365	13.9
NEBC14562	4354602_1_4356839	Mba11I	(RM.Mba11I) EnzType:Type IIG restriction enzyme/methyltransferase; RecSeq:AGGCGA; Org#: 9362; OrgName: Methylophilaceae bacterium 11; Source: L. Chistoserdova; GenBank:JCKJ01000001; SeqLength:1635; Locus:Meth11DRAFT_1370; ProteinId:EUJ10546.1; UniProt:Y0KHD8; GI:577704400	4355187	4355684	13.6
NEBC14562	4359711_1_4361045	EcoKMcrBC	(EcoKMcrB) EnzType:Type IV methyl-directed restriction enzyme; Org#: 1260; OrgName: Escherichia coli K-12 substr. MG1655; Source: F.R. Blattner; GenBank:U00096; SeqLength:459; Locus:b4346; ProteinId:AAC77302.2; UniProt:P15005	4359813	4360001	14.9
