contig	cds	domain	domain_descriptions	start	end	score
NEBC2219	10303_-1_8117	SauNewI	EnzType:Type IV methyl-directed restriction enzyme; RecSeq:SCNGS; Org#: 4806; OrgName: Staphylococcus aureus subsp. aureus str. Newman; Source: T. Baba; GenBank:AP009351; SeqLength:953; Locus:NWMN_2386; ProteinId:BAF68658.1; UniProt:A0A0H3KIS6; GI:150375398	10054	9542	19.3
NEBC2219	15889_-1_13085	M.TacIII	EnzType:Type II methyltransferase; RecSeq:GGCCT; Org#: 5640; OrgName: Thermanaerovibrio acidaminovorans DSM 6589; Source: DSM 6589; GenBank:CP001818; SeqLength:1068; Locus:Taci_1494; ProteinId:ACZ19719.1; UniProt:D1B6S8; GI:269100732	15832	13088	957.2
NEBC2227	9611_1_9841	EcoKMrr	EnzType:Type IV methyl-directed restriction enzyme; Org#: 1260; OrgName: Escherichia coli K-12 substr. MG1655; Source: F.R. Blattner; GenBank:U00096; SeqLength:304; Locus:b4351; ProteinId:AAC77307.1; UniProt:P24202	9623	9838	21.1
NEBC2227	12058_-1_10394	M.Pmi1037I	EnzType:Type II methyltransferase; RecSeq:CATATG; Org#: 31003; OrgName: Parvimonas micra KCOM 1037; Source: J.-K. Kook; GenBank:CP031971; SeqLength:503; Locus:DYJ31_01085; ProteinId:AXU09935.1; UniProt:A0A3B7DL65	11986	10397	81.4
NEBC2227	13344_-1_12046	M.LlaI	EnzType:Type II methyltransferase; Org#: 1685; OrgName: Lactococcus lactis subsp. lactis; Source: T.R. Klaenhammer; GenBank:U17233; SeqLength:622; ProteinId:AAA65073.1; UniProt:P35516; GI:639892	12831	12079	29.4
NEBC2227	13344_-1_12046	M.Tca7334II	EnzType:Type II methyltransferase; RecSeq:RAATTY; Org#: 7270; OrgName: Treponema caldaria DSM 7334; Source: DSM 7334; GenBank:CP002868; SeqLength:371; Locus:Spica_0084; ProteinId:AEJ18255.1; UniProt:F8EY96; GI:338833077	13329	12772	29.6
NEBC2227	13344_-1_12046	M.Hpy188II	EnzType:Type II methyltransferase; RecSeq:CATG; Org#: 1529; OrgName: Helicobacter pylori J188; Source: M.J. Blaser; GenBank:AF250225; SeqLength:353; ProteinId:AAG49536.1; UniProt:Q9APS1; GI:12239882	13338	13009	41.4
NEBC2227	15848_-1_13443	ScoA3Mrr	EnzType:Type IV methyl-directed restriction enzyme; Org#: 2434; OrgName: Streptomyces coelicolor A3(2); Source: D.A. Hopwood; GenBank:AL645882; SeqLength:544; ProteinId:CAC04049.1; UniProt:Q9FCF7; GI:9857170	13895	13452	24.3
NEBC2227	15848_-1_13443	M.Pmi1037I	EnzType:Type II methyltransferase; RecSeq:CATATG; Org#: 31003; OrgName: Parvimonas micra KCOM 1037; Source: J.-K. Kook; GenBank:CP031971; SeqLength:503; Locus:DYJ31_01085; ProteinId:AXU09935.1; UniProt:A0A3B7DL65	15350	14121	59.2
NEBC2227	15848_-1_13443	M.Pae10332II	EnzType:Type II methyltransferase; RecSeq:CAGCTC; Org#: 13368; OrgName: Pseudomonas aeruginosa NCTC10332; Source: NCTC 10332; GenBank:LN831024; SeqLength:1344	15719	15405	24.7
NEBC2227	15848_-1_13443	M2.BstXII	EnzType:Type II methyltransferase; RecSeq:GATC; Org#: 827; OrgName: Bacillus stearothermophilus X1; Source: N. Welker; GenBank:CP008855; SeqLength:266	15809	15540	30.1
NEBC2227	21418_1_21741	I-BthII	EnzType:homing endonuclease ; RecSeq:ATTATCCGTGATGAGTCAATTCA; Org#: 4962; OrgName: Bacillus thuringiensis ssp. pakistani; Source: H. Steiner; GenBank:EU043131; SeqLength:257; ProteinId:ABW06034.1; UniProt:B0YPE6; GI:157955320	21430	21720	35.3
NEB233	2014_1_3066	M.LmoJ3I	EnzType:Type II methyltransferase; RecSeq:GCNGC; Org#: 8917; OrgName: Listeria monocytogenes J3115; Source: S. Kathariou; GenBank:JN235992; SeqLength:327; ProteinId:AEX63364.1; UniProt:I3PGS6; GI:371945562	2020	3033	382.8
NEBC1946	1206_1_1514	M.BsuRI	EnzType:Type II methyltransferase; RecSeq:GGCC; Org#: 861; OrgName: Bacillus subtilis strain R; Source: T.A. Trautner; GenBank:X02988; SeqLength:436; ProteinId:CAA26731.1; UniProt:P06530; GI:40247	1215	1514	63.5
NEBM186	1_1_1398	BtsCI	EnzType:Type II restriction enzyme; RecSeq:GGATG; Org#: 4041; OrgName: Bacillus thermosphaericus; Source: NEB 1621; GenBank:GQ449683; SeqLength:465; ProteinId:ACZ62642.1; UniProt:D2IX37; GI:270155118	1	1395	1040.4
NEBM142	1740_-1_343	BtsCI	EnzType:Type II restriction enzyme; RecSeq:GGATG; Org#: 4041; OrgName: Bacillus thermosphaericus; Source: NEB 1621; GenBank:GQ449683; SeqLength:465; ProteinId:ACZ62642.1; UniProt:D2IX37; GI:270155118	1740	346	1044.2
NEBM142	1867_1_3930	M.BtsCI	EnzType:Type II methyltransferase; RecSeq:GGATG; Org#: 4041; OrgName: Bacillus thermosphaericus; Source: NEB 1621; GenBank:GQ449683; SeqLength:687; ProteinId:ACZ62643.1; UniProt:D2IX38; GI:270155119	1867	3927	1537.1
NEBM187	1_1_1398	BtsCI	EnzType:Type II restriction enzyme; RecSeq:GGATG; Org#: 4041; OrgName: Bacillus thermosphaericus; Source: NEB 1621; GenBank:GQ449683; SeqLength:465; ProteinId:ACZ62642.1; UniProt:D2IX37; GI:270155118	1	1395	1035.8
NEBC1403	1635_-1_811	M.BspRI	EnzType:Type II methyltransferase; RecSeq:GGCC; Org#: 595; OrgName: Bacillus sphaericus R; Source: P. Venetianer; GenBank:X15758; SeqLength:424; ProteinId:CAA33764.2; UniProt:P13906; GI:258593908	1530	832	48.8
NEBC1403	1635_-1_811	M.Pam7686I	EnzType:Type II methyltransferase; RecSeq:CCATGG; Org#: 6650; OrgName: Paracoccus aminophilus; Source: JCM 7686; GenBank:GQ468938; SeqLength:363; ProteinId:ADF47149.1; UniProt:E7BLE4; GI:294869157	1548	1255	69.3
NEBC1407	387_-1_1	M.Bsp460II	EnzType:Type II methyltransferase; RecSeq:AATT; Org#: 18969; OrgName: Brevundimonas species GW460-12-10-14-LB2; Source: A. Deutschbauer; GenBank:CP015511; SeqLength:345; Locus:A4249_09525; ProteinId:ANC53871.1; UniProt:A0A160I0M6; GI:102571446	387	1	241.5
NEBC1410	223_-1_2	RpaB5I	(RM.RpaB5I) EnzType:Type IIG restriction enzyme/methyltransferase; RecSeq:CGRGGAC; Org#: 4291; OrgName: Rhodopseudomonas palustris BisB5; Source: ATCC BAA-1123; GenBank:CP000283; SeqLength:1184; Locus:RPD_3238; ProteinId:ABE40463.1; UniProt:Q134M6; GI:91684161	223	2	85.4
NEBC887	18675_-1_17818	M1.SmuUI	EnzType:Type II methyltransferase; RecSeq:GATC; Org#: 3329; OrgName: Streptococcus mutans UA159; Source: B. Roe; GenBank:AE014133; SeqLength:285; Locus:SMU_504; ProteinId:AAN58249.1; UniProt:Q8DVI4; GI:24376879	18666	18289	14.6
LN869918	1_1_1305	M.NspHI	EnzType:Type II methyltransferase; RecSeq:RCATGY; Org#: 1938; OrgName: Nostoc species; Source: ATCC 29106; GenBank:AF056037; SeqLength:397; ProteinId:AAC97192.1; UniProt:Q9ZHP1; GI:4033740	202	1299	280.0
NEBC1423	23568_1_24470	M.MfoCT6III	EnzType:Type II methyltransferase; RecSeq:ATCGAT; Org#: 12934; OrgName: Mycobacterium fortuitum CT6; Source: K. Costa; GenBank:CP011269; SeqLength:581; Locus:XA26_21390; ProteinId:ALI25984.1; UniProt:A0A0N9XQH2; GI:937419985	23886	24287	21.2
NEBC1423	23568_1_24470	M.HpyUM032XI	EnzType:Type II methyltransferase; RecSeq:GTNNAC; Org#: 10625; OrgName: Helicobacter pylori UM032; Source: J. Vadivelu; GenBank:CP005490; SeqLength:386; Locus:K747_06370; ProteinId:AGL67056.1; GI:499058140	24063	24452	16.8
NEBC1423	34076_1_34876	Cal14237I	(RM.Cal14237I) EnzType:Type IIG restriction enzyme/methyltransferase; RecSeq:GGTTAG; Org#: 6627; OrgName: Cellulophaga algicola DSM 14237; Source: DSM 14237; GenBank:CP002453; SeqLength:1066; Locus:Celal_0210; ProteinId:ADV47560.1; UniProt:E6X7W7	34076	34837	339.8
NEBC1423	34770_1_37082	Cal14237I	(RM.Cal14237I) EnzType:Type IIG restriction enzyme/methyltransferase; RecSeq:GGTTAG; Org#: 6627; OrgName: Cellulophaga algicola DSM 14237; Source: DSM 14237; GenBank:CP002453; SeqLength:1066; Locus:Celal_0210; ProteinId:ADV47560.1; UniProt:E6X7W7	34770	36377	560.4
NEBC1423	34770_1_37082	HpyUM032XIV	(RM.HpyUM032XIV) EnzType:Type IIG restriction enzyme/methyltransferase; RecSeq:GAAAG; Org#: 10625; OrgName: Helicobacter pylori UM032; Source: J. Vadivelu; GenBank:CP005490; SeqLength:1076	35634	36881	20.0
NEBC1423	34770_1_37082	Cal14237I	(RM.Cal14237I) EnzType:Type IIG restriction enzyme/methyltransferase; RecSeq:GGTTAG; Org#: 6627; OrgName: Cellulophaga algicola DSM 14237; Source: DSM 14237; GenBank:CP002453; SeqLength:1066; Locus:Celal_0210; ProteinId:ADV47560.1; UniProt:E6X7W7	36519	37079	64.8
NEBC885	15288_1_17357	EcoKMcrBC	(EcoKMcrB) EnzType:Type IV methyl-directed restriction enzyme; Org#: 1260; OrgName: Escherichia coli K-12 substr. MG1655; Source: F.R. Blattner; GenBank:U00096; SeqLength:459; Locus:b4346; ProteinId:AAC77302.2; UniProt:P15005	16713	17132	30.1
NEB198	471_1_809	C.MunI	EnzType:control protein; RecSeq:GCTTATAGTCCGTTGTTTTTAAAC; Org#: 1824; OrgName: Mycoplasma species; Source: A. Janulaitis; GenBank:X76192; SeqLength:74; ProteinId:CAA53787.1; UniProt:P43640; GI:431929	471	683	27.9
NEB198	799_1_1836	M.Cce743II	EnzType:Type II methyltransferase; RecSeq:CCWGG; Org#: 5878; OrgName: Clostridium cellulovorans 743B; Source: DSM 3052; GenBank:CP002160; SeqLength:363; Locus:Clocel_4008; ProteinId:ADL53671.1; UniProt:D9SLN4; GI:302579659	799	1833	342.8
NEB198	1833_1_3272	BpuJI	EnzType:Type II restriction enzyme; RecSeq:CCCGT; Org#: 3691; OrgName: Bacillus pumilus RFL1458; Source: A. Janulaitis; GenBank:EF409421; SeqLength:462; ProteinId:ABN54439.1; UniProt:A3FMN7; GI:125719298	1851	3236	75.4
NEB198	3242_1_4273	M.LlaDII	EnzType:Type II methyltransferase; RecSeq:GCNGC; Org#: 1669; OrgName: Lactococcus lactis W39; Source: J. Josephsen; GenBank:Y12707; SeqLength:317; ProteinId:CAA73243.1; UniProt:O53067; GI:2765225	3266	4231	193.2
NEBC1625	3_1_338	M.Cfr42I	EnzType:Type II methyltransferase; RecSeq:CCGCGG; Org#: 1036; OrgName: Citrobacter freundii RFL42; Source: A. Janulaitis; GenBank:EU262735; SeqLength:402; ProteinId:ABY83631.1; UniProt:B0LL98; GI:166163613	3	338	111.4
NEB253	807_1_2354	M.DfeI	EnzType:Type II methyltransferase; RecSeq:CTNNAG; Org#: 5522; OrgName: Dyadobacter fermentans DSM 18053; Source: DSM 18053; GenBank:CP001619; SeqLength:493; Locus:Dfer_1174; ProteinId:ACT92423.1; UniProt:C6W563; GI:254947723	825	1301	24.3
NEB253	807_1_2354	TthHB27I	(RM.TthHB27I) EnzType:Type IIG restriction enzyme/methyltransferase; RecSeq:CAARCA; Org#: 3459; OrgName: Thermus thermophilus HB27; Source: T. Hoshino; GenBank:AE017221; SeqLength:1121; Locus:TT_C1877; ProteinId:AAS82219.1; UniProt:Q72GH1; GI:46197807	1152	2147	66.8
NEBC1681	1498_-1_1223	M.Bpa9945I	EnzType:Type II methyltransferase; RecSeq:CCWGG; Org#: 10707; OrgName: Bacillus paralicheniformis 9945A; Source: ATCC 9945A; GenBank:CP005965; SeqLength:445; Locus:BaLi_c08350; ProteinId:AGN35230.1; UniProt:P0DW08; GI:510141499	1498	1277	92.1
NEBC1690	270_1_854	BsaAI	EnzType:Type II restriction enzyme; RecSeq:YACGTR; Org#: 731; OrgName: Bacillus stearothermophilus G668; Source: Z. Chen; GenBank:HQ446231; SeqLength:260; ProteinId:ADQ20494.1; UniProt:E5LGA6; GI:311977236	366	680	18.1
NEB264	4534_-1_2729	M.Sgr13350I	EnzType:Type II methyltransferase; RecSeq:GAGCTC; Org#: 5035; OrgName: Streptomyces griseus subsp. griseus NBRC 13350; Source: NBRC 13350; GenBank:AP009493; SeqLength:363; Locus:SGR_3358; ProteinId:BAG20187.1; UniProt:B1VM77; GI:178465667	4507	3479	218.8
AF254788	4751_-1_1368	M.BsoBI	EnzType:Type II methyltransferase; RecSeq:CYCGRG; Org#: 750; OrgName: Bacillus stearothermophilus JN2091; Source: D. Clark; GenBank:NEBC14184; SeqLength:504	2690	1374	167.8
AF254788	4751_-1_1368	BsgI	(RM.BsgI) EnzType:Type IIG restriction enzyme/methyltransferase; RecSeq:GTGCAG; Org#: 584; OrgName: Bacillus sphaericus GC subgroup; Source: NEB 581; GenBank:HQ636111; SeqLength:1035; ProteinId:ADR73010.1; UniProt:E5Q8V5; GI:313667120	4127	2835	120.8
AF254788	4751_-1_1368	M.BseCI	EnzType:Type II methyltransferase; RecSeq:ATCGAT; Org#: 527; OrgName: Bacillus species; Source: V. Bouriotis; GenBank:X79509; SeqLength:579; ProteinId:CAA56041.1; UniProt:P43423; GI:619639	4460	3717	74.8
AF254788	4751_-1_1368	M.LlaBI	EnzType:Type II methyltransferase; RecSeq:CTRYAG; Org#: 1681; OrgName: Lactococcus lactis subsp. cremoris W56; Source: J. Josephsen; GenBank:X97263; SeqLength:580; ProteinId:CAA65917.1; UniProt:P71445; GI:1617123	4688	4146	21.3
JF432057	3366_1_3599	C.AhdI	EnzType:control protein; RecSeq:ACTCATAGTCCGTGGACTTATCGA; Org#: 107; OrgName: Aeromonas hydrophila; Source: NEB 724; GenBank:CP050994; SeqLength:74; Locus:HFP99_10565; ProteinId:QIY87049.1; UniProt:Q7X0F0	3372	3575	57.0
JF432057	4162_1_5319	M.CcrNAIV	EnzType:Type II methyltransferase; RecSeq:GGCGCC; Org#: 5291; OrgName: Caulobacter crescentus NA1000; Source: S. Crosson; GenBank:CP001340; SeqLength:374; Locus:CCNA_03741; ProteinId:ACL97206.2; UniProt:A0A0H3CFS9	4162	5316	249.8
JF432061	1535_1_2626	M.PflMI	EnzType:Type II methyltransferase; RecSeq:CCANNNNNTGG; Org#: 2067; OrgName: Pseudomonas fluorescens; Source: NEB 375; GenBank:NEBC19541; SeqLength:363	1535	2623	841.5
JF432061	3594_-1_2596	Esp1396I	EnzType:Type II restriction enzyme; RecSeq:CCANNNNNTGG; Org#: 4448; OrgName: Enterobacter species RFL1396; Source: A. Janulaitis; GenBank:AF527822; SeqLength:307; ProteinId:AAO16094.1; UniProt:Q8GGG9; GI:27464467	3588	2692	308.7
NEBM158	1535_1_2626	M.PflMI	EnzType:Type II methyltransferase; RecSeq:CCANNNNNTGG; Org#: 2067; OrgName: Pseudomonas fluorescens; Source: NEB 375; GenBank:NEBC19541; SeqLength:363	1535	2623	841.5
NEBM158	3594_-1_2596	Esp1396I	EnzType:Type II restriction enzyme; RecSeq:CCANNNNNTGG; Org#: 4448; OrgName: Enterobacter species RFL1396; Source: A. Janulaitis; GenBank:AF527822; SeqLength:307; ProteinId:AAO16094.1; UniProt:Q8GGG9; GI:27464467	3588	2692	308.7
NEBC14576	74554_-1_71519	BceJI	EnzType:Type III restriction enzyme; RecSeq:CACAG; Org#: 3368; OrgName: Burkholderia cenocepacia J2315; Source: BCCM LMG 16656; GenBank:AM747720; SeqLength:1010; Locus:BCAL3493; ProteinId:CAR53816.1; UniProt:B4E6M3; GI:198037872	74554	71528	1202.6
NEBC14576	76243_-1_74558	Eco94GmrSD	EnzType:Type IV methyl-directed restriction enzyme; Org#: 9910; OrgName: Escherichia coli STEC_94C; Source: D. Rasko; GenBank:AFDU01000012; SeqLength:629; Locus:ECSTEC94C_1402; ProteinId:EGW84464.1; GI:345352214	76228	75434	33.2
NEBC14576	78295_-1_76256	M.BmaBMKI	EnzType:Type III methyltransferase; RecSeq:CACAG; Org#: 13772; OrgName: Burkholderia mallei 2000031063; Source: K.A. Bishop-Lilly; GenBank:CP008732; SeqLength:671; Locus:DM57_1506; ProteinId:AIO82355.2; GI:703827744	78271	76259	537.4
NEBC14576	84899_1_86299	S.Cbo1051II	EnzType:Type I specificity subunit; RecSeq:ACANNNNNNGTAG; Org#: 27003; OrgName: Clostridium botulinum AM1051; Source: S.L. Johnson; GenBank:CP013841; SeqLength:375; Locus:RSJ13_03755; ProteinId:AUM98169.1	85301	85837	16.2
NEBC14576	135270_1_136304	V.MthTI	EnzType:Type II nicking endonuclease; Org#: 1707; OrgName: Methanobacterium thermoformicicum THF; Source: DSM 3848; GenBank:X68366; SeqLength:221; ProteinId:CAA48433.1; UniProt:P29588; GI:809723	135279	135908	90.2
NEBC14576	199317_-1_198703	M.Eco47II	EnzType:Type II methyltransferase; RecSeq:GGNCC; Org#: 1359; OrgName: Escherichia coli RFL47; Source: A. Janulaitis; GenBank:X82105; SeqLength:417; ProteinId:CAA57629.1; UniProt:P50196; GI:558571	199317	199138	21.3
NEBC14576	227475_-1_226315	M.CocI	EnzType:Type II methyltransferase; RecSeq:GTYRAC; Org#: 5526; OrgName: Capnocytophaga ochracea DSM 7271; Source: DSM 7271; GenBank:CP001632; SeqLength:527; Locus:Coch_0588; ProteinId:ACU92146.1; UniProt:C7M7I9; GI:256581011	226839	226648	16.3
NEBC14576	320123_-1_319815	M.Msy25204I	EnzType:Type II methyltransferase; RecSeq:GATC; Org#: 15392; OrgName: Mycoplasma synoviae ATCC 25204 WVU1853; Source: ATCC 25204; GenBank:CP011096; SeqLength:345; Locus:VY93_01015; ProteinId:AKB10962.1; UniProt:A0A8D3YIZ1; GI:805300833	320123	319860	16.9
NEBC14576	331310_1_332878	M.Aba6411I	EnzType:Type I methyltransferase; RecSeq:CCANNNNNNNNTGG; Org#: 14677; OrgName: Acinetobacter baumannii 6411; Source: J. McCorrison; GenBank:CP010368; SeqLength:480; Locus:RR32_13645	331310	332743	835.2
NEBC14576	332878_1_334074	S.SneJS1I	EnzType:Type I specificity subunit; RecSeq:AACANNNNNNGTA; Org#: 26240; OrgName: Staphylococcus nepalensis JS1; Source: Y.-D. Nam; GenBank:CP017461; SeqLength:423; Locus:BJD96_13990; ProteinId:ATH61439.1; UniProt:A0A291JNW6	332878	333699	243.7
NEBC14576	332878_1_334074	S.MlaZI	EnzType:Type I specificity subunit; RecSeq:ACCNNNNNNRTGA; Org#: 4702; OrgName: Methanocorpusculum labreanum Z; Source: ATCC 43576; GenBank:CP000559; SeqLength:446; Locus:Mlab_0842; ProteinId:ABN07013.1; UniProt:A2SRQ7; GI:124363205	333229	334068	157.2
NEBC14576	336659_1_339535	SauN315I	EnzType:Type I restriction enzyme; RecSeq:AGGNNNNNGAT; Org#: 3187; OrgName: Staphylococcus aureus N315; Source: K. Aoki; GenBank:BA000018; SeqLength:929	336659	339478	732.8
NEBC14576	413307_1_414383	M.Eco86I	EnzType:Type II methyltransferase; RecSeq:GGTACC; Org#: 16605; OrgName: Escherichia coli NCTC86; Source: ATCC 4157; GenBank:LR217818; SeqLength:402; Locus:SAMEA3446340_01311; ProteinId:VFQ34618.1	413307	413939	30.5
NEBC14576	452808_1_453665	M.FpsJVI	EnzType:Type II methyltransferase; RecSeq:CCNGG; Org#: 4803; OrgName: Flavobacterium psychrophilum JIP02/86; Source: ATCC 49511; GenBank:AM398681; SeqLength:335; Locus:FP2150; ProteinId:CAL44211.1; UniProt:A6H1I7; GI:149772728	452808	453653	210.8
NEBC14576	537558_1_538856	M.AspDUT2III	EnzType:Type II methyltransferase; RecSeq:RAATTY; Org#: 18507; OrgName: Acinetobacter species DUT-2; Source: H. Zhou; GenBank:CP014651; SeqLength:430; Locus:A0J50_16380; ProteinId:AMO42045.1; GI:100334023	537558	538853	910.2
NEBC14576	666377_-1_665013	ScoA3II	EnzType:Type IV methyl-directed restriction enzyme; Org#: 2434; OrgName: Streptomyces coelicolor A3(2); Source: D.A. Hopwood; GenBank:AL645882; SeqLength:431; ProteinId:CAB40319.1; UniProt:Q9X8D4; GI:4582372	665639	665178	14.9
NEBC14576	785107_1_785352	S.LveDOK28I	EnzType:Type I specificity subunit; RecSeq:ATGNNNNNNNTCC; Org#: 22817; OrgName: Lacinutrix venerupis DOK2-8; Source: W.-J. Chi; GenBank:CP019352; SeqLength:404; Locus:BWR22_09520; ProteinId:APY00547.1; GI:113498536	785113	785346	15.3
NEBC14576	810666_1_811907	I-LlaI	EnzType:homing endonuclease ; RecSeq:CACATCCATAACCATATCATTTTT; Org#: 1686; OrgName: Lactococcus lactis; Source: M. Gasson; GenBank:X89922; SeqLength:599; ProteinId:CAA61996.1; UniProt:P0A3U1; GI:1296829	810678	811505	112.5
NEBC14576	883425_1_886583	M.Vsp69I	EnzType:Type III methyltransferase; Org#: 8664; OrgName: Vibrio splendidus V69; Source: M. Balado; GenBank:HE646881; SeqLength:1037; ProteinId:CCF17693.1; UniProt:G9AYF8; GI:365733064	883428	886580	879.1
NEBC14576	886590_1_890012	Vsp69I	EnzType:Type III restriction enzyme; Org#: 8664; OrgName: Vibrio splendidus V69; Source: M. Balado; GenBank:HE646881; SeqLength:1154; ProteinId:CCF17694.1; UniProt:G9AYF9; GI:365733065	886590	890009	1235.8
NEBC14576	1036141_-1_1035773	M.Btr192I	EnzType:Type II methyltransferase; RecSeq:GATC; Org#: 8442; OrgName: Bibersteinia trehalosi USDA-ARS-USMARC-192; Source: G.P. Harhay; GenBank:CP003745; SeqLength:269; Locus:WQG_18030; ProteinId:AGH39080.1; UniProt:M4R7G5; GI:469489707	1036135	1035779	16.2
NEBC14576	1080685_1_1082256	M.Aba6411I	EnzType:Type I methyltransferase; RecSeq:CCANNNNNNNNTGG; Org#: 14677; OrgName: Acinetobacter baumannii 6411; Source: J. McCorrison; GenBank:CP010368; SeqLength:480; Locus:RR32_13645	1080685	1082118	871.0
NEBC14576	1082256_1_1083434	S.Psp1015I	EnzType:Type I specificity subunit; RecSeq:GAAGNNNNNCCT; Org#: 20079; OrgName: Planococcus species L10.15; Source: W.S. See-Too; GenBank:CP016540; SeqLength:405; Locus:I858_004645; ProteinId:ANU26321.1; UniProt:A0A1B1RZF5; GI:104499185	1082271	1082990	231.1
NEBC14576	1082256_1_1083434	S.EcoF6699I	EnzType:Type I specificity subunit; RecSeq:GGCANNNNNNNTTC; Org#: 25977; OrgName: Escherichia coli O6:H16 F6699; Source: P. Smith; GenBank:CP024266; SeqLength:365	1082670	1083431	197.3
NEBC14576	1084047_1_1084877	EcoKMcrA	EnzType:Type IV methyl-directed restriction enzyme; RecSeq:YCGR; Org#: 1260; OrgName: Escherichia coli K-12 substr. MG1655; Source: F.R. Blattner; GenBank:U00096; SeqLength:277; Locus:b1159; ProteinId:AAC74243.1; UniProt:P24200	1084443	1084868	29.3
NEBC14576	1086590_1_1089466	SauN315I	EnzType:Type I restriction enzyme; RecSeq:AGGNNNNNGAT; Org#: 3187; OrgName: Staphylococcus aureus N315; Source: K. Aoki; GenBank:BA000018; SeqLength:929	1086590	1089409	732.4
NEBC14576	1132727_1_1133968	I-LlaI	EnzType:homing endonuclease ; RecSeq:CACATCCATAACCATATCATTTTT; Org#: 1686; OrgName: Lactococcus lactis; Source: M. Gasson; GenBank:X89922; SeqLength:599; ProteinId:CAA61996.1; UniProt:P0A3U1; GI:1296829	1132739	1133566	112.5
NEBC14576	1370486_-1_1369920	M.VspI	EnzType:Type II methyltransferase; RecSeq:ATTAAT; Org#: 3055; OrgName: Vibrio species 343; Source: S.K. Degtyarev; GenBank:X68658; SeqLength:544	1370450	1370037	21.1
NEBC14576	1376413_-1_1375703	V.MthTI	EnzType:Type II nicking endonuclease; Org#: 1707; OrgName: Methanobacterium thermoformicicum THF; Source: DSM 3848; GenBank:X68366; SeqLength:221; ProteinId:CAA48433.1; UniProt:P29588; GI:809723	1376383	1375751	63.2
NEBC14576	1381264_-1_1380782	S.Eco348I	EnzType:Type I specificity subunit; RecSeq:RTCANNNNNNNNGTGG; Org#: 25026; OrgName: Escherichia coli O104:H4 FDAARGOS_348; Source: T. Minogue; GenBank:CP022086; SeqLength:578; Locus:CEQ26_25840; ProteinId:ASF05293.1	1381069	1380794	14.5
NEBC14576	1399174_-1_1398455	M.BspD6I	EnzType:Type II methyltransferase; RecSeq:GASTC; Org#: 3304; OrgName: Bacillus species D6; Source: N.I. Matvienko; GenBank:EF371514; SeqLength:301; ProteinId:ABN42184.1; UniProt:A3FEV9; GI:125396998	1398868	1398554	15.4
NEBC14576	1785177_-1_1783798	M.BepI	EnzType:Type II methyltransferase; RecSeq:CGCG; Org#: 926; OrgName: Brevibacterium epidermidis; Source: P. Venetianer; GenBank:X13555; SeqLength:403; ProteinId:CAA31907.1; UniProt:P10283; GI:580766	1784721	1784191	16.7
NEBC14576	1803885_1_1804916	M.Hpy66XIII	EnzType:Type II methyltransferase; RecSeq:GTNNAC; Org#: 10628; OrgName: Helicobacter pylori UM066; Source: J. Vadivelu; GenBank:CP005493; SeqLength:386; Locus:K751_02895; ProteinId:AGL71158.1; UniProt:R4QAL4; GI:499062523	1804500	1804715	17.5
NEBC14576	1949333_-1_1949010	M2.Pin25611FI	EnzType:Type II methyltransferase; RecSeq:GGATG; Org#: 3857; OrgName: Prevotella intermedia ATCC 25611F; Source: ATCC 25611; GenBank:CP019301; SeqLength:311; Locus:BWX39_09685; ProteinId:APW33336.1; UniProt:A0A1P8JHV8; GI:113273068	1949255	1949013	15.2
NEBC14576	2015358_-1_2014096	M.Cis15098I	EnzType:Type I methyltransferase; RecSeq:GCANNNNNNCCT; Org#: 19648; OrgName: Clostridium isatidis; Source: DSM 15098; GenBank:CP016786; SeqLength:495; Locus:BEN51_05060; ProteinId:ASW42860.1; UniProt:A0A343JBF2	2015262	2014102	90.3
NEBC14576	2016044_-1_2015373	S.Pla5II	EnzType:Type I specificity subunit; RecSeq:AYCNNNNNCTTC; Org#: 12097; OrgName: Persephonella sp. IF05-L8 strain IFO5_L8; Source: A.L. Reysenbach; GenBank:JNLJ01000001; SeqLength:463	2015993	2015376	41.9
NEBC14576	2059396_-1_2058926	M.Csa8155I	EnzType:Type I methyltransferase; RecSeq:GAANNNNNNNTAAA; Org#: 16807; OrgName: Cronobacter sakazakii NCTC 8155; Source: NCTC 8155; GenBank:CP012254; SeqLength:520	2059342	2058959	14.1
NEBC14576	2116302_-1_2113459	SpnD39IIIA	EnzType:Type I restriction enzyme; RecSeq:CRAANNNNNNNNCTG; Org#: 4547; OrgName: Streptococcus pneumoniae D39; Source: J.A. Lanie; GenBank:KJ955483; SeqLength:777; ProteinId:AIL49823.1; UniProt:A0A088DA51; GI:675153041	2115807	2115292	14.5
NEBC14576	2149148_-1_2148690	M.MspI	EnzType:Type II methyltransferase; RecSeq:CCGG; Org#: 1805; OrgName: Moraxella species ATCC 49670; Source: ATCC 49670; GenBank:CP051211; SeqLength:418; Locus:HGD77_16790; ProteinId:PRJNA622823:HGD	2149001	2148750	14.3
NEBC14576	2200356_-1_2199634	Nt.CviQII	EnzType:Type II nicking endonuclease; RecSeq:RAG; Org#: 994; OrgName: Chlorella virus NY-2A; Source: J.L. Van Etten; GenBank:DQ355510; SeqLength:550; ProteinId:ABC86589.1; UniProt:Q0ZLZ5; GI:86129871	2199984	2199661	15.8
NEBC14576	2206220_-1_2204193	ScoA3I	EnzType:Type IV methyl-directed restriction enzyme; Org#: 2434; OrgName: Streptomyces coelicolor A3(2); Source: D.A. Hopwood; GenBank:AL645882; SeqLength:945; ProteinId:CAB65593.1; UniProt:Q9RD88; GI:6689196	2204972	2204277	28.6
NEBC14576	2224105_-1_2221829	EcoKMcrBC	(EcoKMcrB) EnzType:Type IV methyl-directed restriction enzyme; Org#: 1260; OrgName: Escherichia coli K-12 substr. MG1655; Source: F.R. Blattner; GenBank:U00096; SeqLength:459; Locus:b4346; ProteinId:AAC77302.2; UniProt:P15005	2222659	2222069	16.4
NEBC14576	2224105_-1_2221829	EcoKMcrBC	(EcoKMcrB) EnzType:Type IV methyl-directed restriction enzyme; Org#: 1260; OrgName: Escherichia coli K-12 substr. MG1655; Source: F.R. Blattner; GenBank:U00096; SeqLength:459; Locus:b4346; ProteinId:AAC77302.2; UniProt:P15005	2223553	2223209	17.0
NEBC14576	2348296_-1_2347478	M.BbrUIII	EnzType:Type II methyltransferase; RecSeq:CTGCAG; Org#: 5698; OrgName: Bifidobacterium breve UCC2003; Source: D. van Sinderen; GenBank:CP000303; SeqLength:467; Locus:Bbr_1119; ProteinId:ABE95797.1; GI:339479329	2348050	2347727	20.6
NEBC14576	2383884_1_2384792	M.AorT14III	EnzType:Type II methyltransferase; RecSeq:GTCGAC; Org#: 18254; OrgName: Actinomyces oris T14V; Source: M.E. Holder; GenBank:CP014232; SeqLength:590	2384316	2384609	18.7
NEBC14576	2465855_-1_2464704	SauNewI	EnzType:Type IV methyl-directed restriction enzyme; RecSeq:SCNGS; Org#: 4806; OrgName: Staphylococcus aureus subsp. aureus str. Newman; Source: T. Baba; GenBank:AP009351; SeqLength:953; Locus:NWMN_2386; ProteinId:BAF68658.1; UniProt:A0A0H3KIS6; GI:150375398	2465240	2464749	26.6
NEBC14576	2508453_-1_2505874	EcoKMcrBC	(EcoKMcrB) EnzType:Type IV methyl-directed restriction enzyme; Org#: 1260; OrgName: Escherichia coli K-12 substr. MG1655; Source: F.R. Blattner; GenBank:U00096; SeqLength:459; Locus:b4346; ProteinId:AAC77302.2; UniProt:P15005	2506671	2506345	14.7
NEBC14576	2611002_-1_2608291	SauN315I	EnzType:Type I restriction enzyme; RecSeq:AGGNNNNNGAT; Org#: 3187; OrgName: Staphylococcus aureus N315; Source: K. Aoki; GenBank:BA000018; SeqLength:929	2610999	2608348	680.3
NEBC14576	2616643_-1_2614250	EcoMVII	(RM.EcoMVII) EnzType:Type IIG restriction enzyme/methyltransferase; RecSeq:CANCATC; Org#: 13018; OrgName: Escherichia coli O25b:H4-ST131 EC958; Source: S. Beatson; GenBank:HG941718; SeqLength:1201; Locus:EC958_4083; ProteinId:CDN84435.1; UniProt:W8ZPW8; GI:641686606	2615548	2615045	20.2
