contig	cds	domain	domain_descriptions	start	end	score
NEB218	392_1_2287	M.FokI	EnzType:Type II methyltransferase; RecSeq:GGATG; Org#: 1440; OrgName: Flavobacterium okeanokoites; Source: IFO 12536; GenBank:M28828; SeqLength:647; ProteinId:AAA24933.1; UniProt:P14871; GI:148724	449	2281	405.6
NEBC1462	2009_-1_933	M.Pth25325I	EnzType:Type II methyltransferase; RecSeq:GTWWAC; Org#: 15792; OrgName: Pandoraea thiooxydans; Source: DSM 25325; GenBank:CP011568; SeqLength:286; Locus:ABW99_10105; ProteinId:AKJ68511.1; UniProt:A0A0G3EUZ2; GI:827098716	1178	948	56.6
NEBC1462	2009_-1_933	M.NciI	EnzType:Type II methyltransferase; RecSeq:CCSGG; Org#: 1840; OrgName: Neisseria cinerea; Source: NRCC 31006; GenBank:JF432062; SeqLength:513; ProteinId:ADZ31429.1; UniProt:F1KM54; GI:325564263	1346	951	42.4
NEB222	874_1_1665	SfeI	EnzType:Type II restriction enzyme; RecSeq:CTRYAG; Org#: 2380; OrgName: Streptococcus faecalis; Source: S.K. Degtyarev; GenBank:AY151403; SeqLength:293; ProteinId:AAN71749.1; UniProt:Q8GKQ3; GI:25140454	1105	1521	32.3
NEB222	3472_-1_1652	M.MfoCT6II	EnzType:Type II methyltransferase; RecSeq:CTCGAG; Org#: 12934; OrgName: Mycobacterium fortuitum CT6; Source: K. Costa; GenBank:CP011269; SeqLength:603	3319	1673	175.0
EF143916	699_1_1838	M1.BfiI	EnzType:Type II methyltransferase; RecSeq:ACTGGG; Org#: 280; OrgName: Bacillus firmus S8120; Source: A. Janulaitis; GenBank:AJ290970; SeqLength:380; ProteinId:CAC12781.1; UniProt:Q9F4D1; GI:10798461	702	1835	668.7
EF143916	1870_1_3384	M2.BfiI	EnzType:Type II methyltransferase; RecSeq:ACTGGG; Org#: 280; OrgName: Bacillus firmus S8120; Source: A. Janulaitis; GenBank:AJ290970; SeqLength:504; ProteinId:CAC12782.1; UniProt:Q9F4D0; GI:10798462	1870	3381	874.5
EF143916	4509_-1_3433	BfiI	EnzType:Type II restriction enzyme; RecSeq:ACTGGG; Org#: 280; OrgName: Bacillus firmus S8120; Source: A. Janulaitis; GenBank:AJ290970; SeqLength:358; ProteinId:CAC12783.1; UniProt:Q9F4C9; GI:10798463	4509	3436	669.3
NEBM106	692_1_2290	M1.BtsI	EnzType:Type II methyltransferase; RecSeq:GCAGTG; Org#: 873; OrgName: Bacillus thermoglucosidasius; Source: NEB 1137; GenBank:DQ355163; SeqLength:532; ProteinId:ABC75873.1; UniProt:Q2I0M1; GI:85720923	692	2287	1201.6
NEBM106	2796_1_3977	M2.BtsI	EnzType:Type II methyltransferase; RecSeq:GCAGTG; Org#: 873; OrgName: Bacillus thermoglucosidasius; Source: NEB 1137; GenBank:DQ355163; SeqLength:393; ProteinId:ABC75875.1; UniProt:Q2I0L9; GI:85720925	2796	3974	891.5
NEBM106	5316_-1_4330	BtsI	(BtsIB) EnzType:Type II restriction enzyme; RecSeq:GCAGTG; Org#: 873; OrgName: Bacillus thermoglucosidasius; Source: NEB 1137; GenBank:DQ355163; SeqLength:328; ProteinId:ABC75876.1; UniProt:Q2I0M2; GI:85720926	5316	4333	737.9
NEBC2190	1974_-1_1153	M2.BstXII	EnzType:Type II methyltransferase; RecSeq:GATC; Org#: 827; OrgName: Bacillus stearothermophilus X1; Source: N. Welker; GenBank:CP008855; SeqLength:266	1956	1159	379.0
NEBC2190	2951_-1_2022	M.TspX514I	EnzType:Type II methyltransferase; RecSeq:GATC; Org#: 4974; OrgName: Thermoanaerobacter sp. X514; Source: ATCC BAA-938; GenBank:CP000923; SeqLength:317; Locus:Teth514_0458; ProteinId:ABY91768.1; UniProt:B0K396; GI:166853359	2951	2028	360.6
NEB255	1034_1_2383	M.NcoI	EnzType:Type II methyltransferase; RecSeq:CCATGG; Org#: 1910; OrgName: Nocardia corallina; Source: ATCC 19070; GenBank:AF068761; SeqLength:422; ProteinId:AAC23514.1; UniProt:O85488; GI:3219718	1130	2377	216.9
NEB255	2388_1_3245	NcoI	EnzType:Type II restriction enzyme; RecSeq:CCATGG; Org#: 1910; OrgName: Nocardia corallina; Source: ATCC 19070; GenBank:AF068761; SeqLength:288; ProteinId:AAC23515.1; UniProt:O85489; GI:3219719	2424	3200	46.3
NEBC2195	1097_-1_3	S.RspPBTS2I	EnzType:Type I specificity subunit; RecSeq:GCCANNNNNNTAC; Org#: 19688; OrgName: Rhodococcus species PBTS2; Source: R. Stamer; GenBank:CP015220; SeqLength:398; Locus:A3Q41_04824; ProteinId:AMY26086.1; UniProt:A0A143QTF8; GI:101721604	896	30	138.2
NEBC2195	1097_-1_3	S.Sen7346III	EnzType:Type I specificity subunit; RecSeq:TGAGNNNNNTGA; Org#: 42295; OrgName: Salmonella enterica NCTC7346; Source: S. Doyle; GenBank:UGWF01000001; SeqLength:415; Locus:NCTC7346_00156; ProteinId:SUF18466.1	1097	393	210.8
NEBC2195	2641_-1_1094	M.BstXI	EnzType:Type II methyltransferase; RecSeq:CCANNNNNNTGG; Org#: 827; OrgName: Bacillus stearothermophilus X1; Source: N. Welker; GenBank:CP008855; SeqLength:511; Locus:HW35_09765; ProteinId:AIM16525.1; GI:675844854	2638	1097	667.5
NEBC2195	4640_-1_3453	S.Ead53II	EnzType:Type I specificity subunit; RecSeq:GGCANNNNNNNTTTC; Org#: 37664; OrgName: Ensifer adhaerens Corn53; Source: G.A. Shaw; GenBank:CP030262; SeqLength:387; Locus:DQW09_16640; ProteinId:QHG71375.1	4067	3501	44.6
NEBC2195	4640_-1_3453	M.BstUII	EnzType:Type I methyltransferase; RecSeq:GATNNNNNNTCG; Org#: 816; OrgName: Bacillus stearothermophilus U458; Source: Z. Chen; GenBank:CP064060; SeqLength:494; Locus:ISX45_04325; ProteinId:PRJNA622823:ISX	4640	4029	171.4
NEBC8677	45603_1_46139	FokI	EnzType:Type II restriction enzyme; RecSeq:GGATG; Org#: 1440; OrgName: Flavobacterium okeanokoites; Source: IFO 12536; GenBank:J04623; SeqLength:583; ProteinId:AAA24927.1; UniProt:P14870; GI:148707	45672	46052	17.0
NEBC8677	130777_1_131766	M.Lla1403I	EnzType:Type I methyltransferase; Org#: 1665; OrgName: Lactococcus lactis IL1403; Source: M. Chopin; GenBank:AE005176; SeqLength:515; Locus:L0309; ProteinId:AAK04749.1; UniProt:Q7DAW4; GI:12723556	131038	131742	33.6
NEBC8677	182458_1_183228	M.MjaIV	EnzType:Type II methyltransferase; RecSeq:GTNNAC; Org#: 1713; OrgName: Methanocaldococcus jannaschii DSM 2661; Source: DSM 2661; GenBank:L77117; SeqLength:523	182494	182811	19.8
NEBC8677	376288_-1_376043	Eco57I	(RM.Eco57I) EnzType:Type IIG restriction enzyme/methyltransferase; RecSeq:CTGAAG; Org#: 1367; OrgName: Escherichia coli RFL57; Source: A. Janulaitis; GenBank:M74821; SeqLength:997; ProteinId:AAA23389.1; UniProt:P25239; GI:145139	376279	376061	13.5
NEBC8677	381257_-1_380553	M.Msy25204I	EnzType:Type II methyltransferase; RecSeq:GATC; Org#: 15392; OrgName: Mycoplasma synoviae ATCC 25204 WVU1853; Source: ATCC 25204; GenBank:CP011096; SeqLength:345; Locus:VY93_01015; ProteinId:AKB10962.1; UniProt:A0A8D3YIZ1; GI:805300833	381236	380982	20.3
NEBC8677	383340_1_384182	M.BalI	EnzType:Type II methyltransferase; RecSeq:TGGCCA; Org#: 924; OrgName: Brevibacterium albidum; Source: ATCC 15831; GenBank:D82028; SeqLength:280; ProteinId:BAA11514.1; UniProt:P71101; GI:1620876	383361	384134	243.2
NEBC8677	389111_1_389953	M.Cdi630I	EnzType:Type II methyltransferase; RecSeq:TGGCCA; Org#: 3249; OrgName: Clostridium difficile 630; Source: ATCC BAA-1382; GenBank:AM180355; SeqLength:268; Locus:CD630_09350; ProteinId:CAJ67771.1; UniProt:Q18AC6; GI:115249951	389153	389935	252.4
NEBC8677	433048_1_433791	M.MjaV	EnzType:Type II methyltransferase; RecSeq:GTAC; Org#: 1713; OrgName: Methanocaldococcus jannaschii DSM 2661; Source: DSM 2661; GenBank:L77117; SeqLength:292; Locus:MJ_1498; ProteinId:AAB99509.1; UniProt:Q58893; GI:1592134	433066	433341	15.8
NEBC8677	440162_1_440392	HaeIV	(RM.HaeIV) EnzType:Type IIG restriction enzyme/methyltransferase; RecSeq:GAYNNNNNRTC; Org#: 1474; OrgName: Haemophilus aegyptius; Source: ATCC 11116; GenBank:AF060542; SeqLength:953; ProteinId:AAC33717.1; UniProt:O85299; GI:3511126	440171	440383	17.5
NEBC8677	451813_1_452751	M.Pae10332II	EnzType:Type II methyltransferase; RecSeq:CAGCTC; Org#: 13368; OrgName: Pseudomonas aeruginosa NCTC10332; Source: NCTC 10332; GenBank:LN831024; SeqLength:1344	451996	452469	14.1
NEBC8677	451813_1_452751	M.BceJIII	EnzType:Type II methyltransferase; RecSeq:SAY; Org#: 3368; OrgName: Burkholderia cenocepacia J2315; Source: BCCM LMG 16656; GenBank:AM747723; SeqLength:217; Locus:pBCA072; ProteinId:CAR57782.1; UniProt:B4EQL0; GI:195945155	452215	452481	16.4
NEBC8677	475488_1_476795	SauNewI	EnzType:Type IV methyl-directed restriction enzyme; RecSeq:SCNGS; Org#: 4806; OrgName: Staphylococcus aureus subsp. aureus str. Newman; Source: T. Baba; GenBank:AP009351; SeqLength:953; Locus:NWMN_2386; ProteinId:BAF68658.1; UniProt:A0A0H3KIS6; GI:150375398	476040	476549	32.2
NEBC8677	628536_-1_627997	S.Psp1015I	EnzType:Type I specificity subunit; RecSeq:GAAGNNNNNCCT; Org#: 20079; OrgName: Planococcus species L10.15; Source: W.S. See-Too; GenBank:CP016540; SeqLength:405; Locus:I858_004645; ProteinId:ANU26321.1; UniProt:A0A1B1RZF5; GI:104499185	628446	628012	15.5
NEBC8677	661618_-1_661223	M.EsaSP1I	EnzType:Type I methyltransferase; RecSeq:GAGNNNNNNCTTC; Org#: 12474; OrgName: Enterobacter sacchari SP1; Source: W. Ye; GenBank:CP007215; SeqLength:708; Locus:C813_13285; ProteinId:AHJ75595.1	661477	661235	13.7
NEBC8677	712226_1_712855	M1.Mma5219I	EnzType:Type I methyltransferase; RecSeq:TCYNNNNNNTCG; Org#: 969; OrgName: Methanohalophilus mahii DSM 5219; Source: DSM 5219; GenBank:CP001994; SeqLength:494; Locus:Mmah_1042; ProteinId:ADE36557.1; UniProt:D5EBK6; GI:292666708	712304	712573	14.1
NEBC8677	790004_1_790717	V.MthTI	EnzType:Type II nicking endonuclease; Org#: 1707; OrgName: Methanobacterium thermoformicicum THF; Source: DSM 3848; GenBank:X68366; SeqLength:221; ProteinId:CAA48433.1; UniProt:P29588; GI:809723	790091	790681	86.5
NEBC8677	923487_1_924299	M.AspACNIH2I	EnzType:Type I methyltransferase; RecSeq:GNAANNNNNNNCTGG; Org#: 27419; OrgName: Acinetobacter species ACNIH2; Source: J.A. Segre; GenBank:CP026412; SeqLength:758; Locus:C3F34_13460; ProteinId:AUX86941.1; UniProt:A0A2L0HXD7	923562	923900	13.2
NEBC8677	1026227_1_1026724	S.Vna16374I	EnzType:Type I specificity subunit; RecSeq:TTAGNNNNNNCTTG; Org#: 19660; OrgName: Vibrio natriegens CCUG 16374; Source: M.T. Weinstock; GenBank:CP016351; SeqLength:458; Locus:BA894_04805; ProteinId:ANQ25805.1; UniProt:A0A1B1EAW2; GI:104239139	1026383	1026706	14.5
NEBC8677	1104013_1_1105152	M.Axy10807I	EnzType:Type I methyltransferase; RecSeq:CAANNNNNNNTACG; Org#: 13806; OrgName: Achromobacter xylosoxidans subsp. xylosoxidans; Source: NCTC 10807; GenBank:LN831029; SeqLength:554; Locus:ERS451415_05354; ProteinId:CKI14405.1; UniProt:A0A0D6ILJ7; GI:777201855	1104169	1105023	15.6
NEBC8677	1104013_1_1105152	M.Pfe45I	EnzType:Type I methyltransferase; RecSeq:AYCNNNNNGTCC; Org#: 9384; OrgName: Pelosinus fermentans JBW45; Source: K.B. De Leon; GenBank:CP010978; SeqLength:521; Locus:JBW_02586; ProteinId:AJQ27930.1; UniProt:I9DN37; GI:763685680	1104541	1105026	21.5
NEBC8677	1141416_1_1141640	M.BalI	EnzType:Type II methyltransferase; RecSeq:TGGCCA; Org#: 924; OrgName: Brevibacterium albidum; Source: ATCC 15831; GenBank:D82028; SeqLength:280; ProteinId:BAA11514.1; UniProt:P71101; GI:1620876	1141416	1141583	20.8
NEBC8677	1177611_1_1178036	M.Hpy99VII	EnzType:Type II methyltransferase; RecSeq:TCGA; Org#: 1531; OrgName: Helicobacter pylori J99; Source: R.A. Alm; GenBank:AE001439; SeqLength:390; Locus:jhp_0244; ProteinId:AAD05820.1; UniProt:Q9ZMH6; GI:4154761	1177671	1177898	14.4
NEBC8677	1203904_-1_1203683	C.BamHI	EnzType:control protein; RecSeq:ACTTATAGTCTGTAGCCTATAGTC; Org#: 208; OrgName: Bacillus amyloliquefaciens H; Source: ATCC 49763; GenBank:CP041693; SeqLength:81; Locus:FOG69_16000; ProteinId:QDP93515.1	1203892	1203689	16.0
NEBC8677	1296076_-1_1295747	MspA1I	EnzType:Type II restriction enzyme; RecSeq:CMGCKG; Org#: 1800; OrgName: Moraxella species A1; Source: S.K. Degtyarev; GenBank:AY466402; SeqLength:266; ProteinId:AAR30095.1; UniProt:Q6S4U8; GI:39726295	1296061	1295753	18.3
NEBC8666	11448_1_13883	EcoKMcrBC	(EcoKMcrB) EnzType:Type IV methyl-directed restriction enzyme; Org#: 1260; OrgName: Escherichia coli K-12 substr. MG1655; Source: F.R. Blattner; GenBank:U00096; SeqLength:459; Locus:b4346; ProteinId:AAC77302.2; UniProt:P15005	13053	13397	17.3
NEBC8666	82489_1_82803	M.PspGI	EnzType:Type II methyltransferase; RecSeq:CCWGG; Org#: 2147; OrgName: Pyrococcus species G1H; Source: NEB 906; GenBank:AF067805; SeqLength:433; ProteinId:AAC67523.1; UniProt:O93645; GI:3789861	82489	82797	46.6
NEBC8666	173124_-1_172681	M.Msy25204I	EnzType:Type II methyltransferase; RecSeq:GATC; Org#: 15392; OrgName: Mycoplasma synoviae ATCC 25204 WVU1853; Source: ATCC 25204; GenBank:CP011096; SeqLength:345; Locus:VY93_01015; ProteinId:AKB10962.1; UniProt:A0A8D3YIZ1; GI:805300833	173121	172804	17.4
NEBC8666	173124_-1_172681	C.AhdI	EnzType:control protein; RecSeq:ACTCATAGTCCGTGGACTTATCGA; Org#: 107; OrgName: Aeromonas hydrophila; Source: NEB 724; GenBank:CP050994; SeqLength:74; Locus:HFP99_10565; ProteinId:QIY87049.1; UniProt:Q7X0F0	173124	172933	20.4
NEBC8666	180154_1_180966	M.Cdi630I	EnzType:Type II methyltransferase; RecSeq:TGGCCA; Org#: 3249; OrgName: Clostridium difficile 630; Source: ATCC BAA-1382; GenBank:AM180355; SeqLength:268; Locus:CD630_09350; ProteinId:CAJ67771.1; UniProt:Q18AC6; GI:115249951	180154	180957	282.2
NEBC8666	211125_-1_210826	M2.BstXII	EnzType:Type II methyltransferase; RecSeq:GATC; Org#: 827; OrgName: Bacillus stearothermophilus X1; Source: N. Welker; GenBank:CP008855; SeqLength:266	211119	210829	16.0
NEBC8666	230122_-1_229427	CjeNII	(RM.CjeNII) EnzType:Type IIG restriction enzyme/methyltransferase; RecSeq:GAGNNNNNGT; Org#: 951; OrgName: Campylobacter jejuni 11168; Source: NCTC 11168; GenBank:AL111168; SeqLength:1339; Locus:Cj1051c; ProteinId:CAL35169.1; UniProt:Q0P9K1; GI:112360373	229921	229439	15.9
NEBC8666	303716_1_305017	M2.Sgr13350III	EnzType:Type II methyltransferase; RecSeq:GCTCTTC; Org#: 5035; OrgName: Streptomyces griseus subsp. griseus NBRC 13350; Source: NBRC 13350; GenBank:NEBC8632; SeqLength:445	303740	305014	393.6
NEBC8666	305035_1_306165	M2.BtsI	EnzType:Type II methyltransferase; RecSeq:GCAGTG; Org#: 873; OrgName: Bacillus thermoglucosidasius; Source: NEB 1137; GenBank:DQ355163; SeqLength:393; ProteinId:ABC75875.1; UniProt:Q2I0L9; GI:85720925	305044	305538	52.6
NEBC8666	305035_1_306165	M1.BceSIII	EnzType:Type II methyltransferase; RecSeq:ACGGC; Org#: 244; OrgName: Bacillus cereus ATCC 10987; Source: ATCC 10987; GenBank:AE017194; SeqLength:438; Locus:BCE_5606; ProteinId:AAS44506.1; UniProt:Q72WX2; GI:42740583	305047	305889	26.5
NEBC8666	305035_1_306165	M.Dac11109II	EnzType:Type II methyltransferase; RecSeq:GTAC; Org#: 6881; OrgName: Desulfobacca acetoxidans DSM 11109; Source: DSM 11109; GenBank:CP002629; SeqLength:424; Locus:Desac_0610; ProteinId:AEB08496.1; UniProt:F2NG83; GI:328452667	305764	306135	20.1
NEBC8666	307756_-1_307523	C.BglII	EnzType:control protein; RecSeq:ACTTATAGTCCGTGGACACATAGT; Org#: 283; OrgName: Bacillus globigii; Source: ATCC 49760; GenBank:CP014840; SeqLength:77; Locus:A1D11_20265; ProteinId:AMR64578.1; UniProt:A0A7Z9E677; GI:100929148	307756	307529	69.6
NEBC8666	492398_1_492970	M.Cce743II	EnzType:Type II methyltransferase; RecSeq:CCWGG; Org#: 5878; OrgName: Clostridium cellulovorans 743B; Source: DSM 3052; GenBank:CP002160; SeqLength:363; Locus:Clocel_4008; ProteinId:ADL53671.1; UniProt:D9SLN4; GI:302579659	492524	492865	14.9
NEBC8666	607275_1_608672	EcoKMcrBC	(EcoKMcrB) EnzType:Type IV methyl-directed restriction enzyme; Org#: 1260; OrgName: Escherichia coli K-12 substr. MG1655; Source: F.R. Blattner; GenBank:U00096; SeqLength:459; Locus:b4346; ProteinId:AAC77302.2; UniProt:P15005	607347	607553	16.5
NEBC8666	685588_1_686487	C.AhdI	EnzType:control protein; RecSeq:ACTCATAGTCCGTGGACTTATCGA; Org#: 107; OrgName: Aeromonas hydrophila; Source: NEB 724; GenBank:CP050994; SeqLength:74; Locus:HFP99_10565; ProteinId:QIY87049.1; UniProt:Q7X0F0	685600	685818	18.7
NEBC8666	694664_-1_694362	McaCI	EnzType:Type II restriction enzyme; RecSeq:CCATC; Org#: 4227; OrgName: Mycoplasma capricolum subsp. capricolum ATCC 27343; Source: ATCC 27343; GenBank:CP000123; SeqLength:525; Locus:MCAP_0050; ProteinId:ABC01183.1; UniProt:Q2ST66; GI:83283251	694664	694404	15.3
NEBC8666	708523_-1_708143	C.EcoO109I	EnzType:control protein; RecSeq:CTAAGNNNNNCTTAG; Org#: 1252; OrgName: Escherichia coli H709c; Source: I. Orskov; GenBank:AF157599; SeqLength:101; ProteinId:AAF06963.1; UniProt:Q9RPJ4; GI:6318606	708514	708305	30.7
NEBC8666	708691_1_708876	C.SptAI	EnzType:control protein; Org#: 4060; OrgName: Salmonella enterica subsp. enterica serovar Paratyphi A str. ATCC 9150; Source: ATCC 9150; GenBank:CP000026; SeqLength:78; Locus:SPA4290; ProteinId:AAV80023.1; UniProt:A0A0H2WVK7; GI:56130517	708691	708873	20.6
NEBC8666	711528_1_711884	M.Cdi630I	EnzType:Type II methyltransferase; RecSeq:TGGCCA; Org#: 3249; OrgName: Clostridium difficile 630; Source: ATCC BAA-1382; GenBank:AM180355; SeqLength:268; Locus:CD630_09350; ProteinId:CAJ67771.1; UniProt:Q18AC6; GI:115249951	711549	711866	67.2
NEBC8666	745397_1_745894	S.Vna16374I	EnzType:Type I specificity subunit; RecSeq:TTAGNNNNNNCTTG; Org#: 19660; OrgName: Vibrio natriegens CCUG 16374; Source: M.T. Weinstock; GenBank:CP016351; SeqLength:458; Locus:BA894_04805; ProteinId:ANQ25805.1; UniProt:A0A1B1EAW2; GI:104239139	745565	745870	21.3
NEBC8666	870481_1_873726	EcoKI	EnzType:Type I restriction enzyme; RecSeq:AACNNNNNNGTGC; Org#: 1260; OrgName: Escherichia coli K-12 substr. MG1655; Source: F.R. Blattner; GenBank:U00096; SeqLength:1170; Locus:b4350; ProteinId:AAC77306.2; UniProt:P08956	870481	870996	46.4
NEBC8666	870481_1_873726	EcoKI	EnzType:Type I restriction enzyme; RecSeq:AACNNNNNNGTGC; Org#: 1260; OrgName: Escherichia coli K-12 substr. MG1655; Source: F.R. Blattner; GenBank:U00096; SeqLength:1170; Locus:b4350; ProteinId:AAC77306.2; UniProt:P08956	870895	873699	717.2
NEBC8666	873727_1_875208	M.BsrFII	EnzType:Type I methyltransferase; RecSeq:TTCANNNNNNNCTC; Org#: 691; OrgName: Bacillus stearothermophilus CPW16; Source: Z. Chen; GenBank:CP051162; SeqLength:492; Locus:HF500_07150; ProteinId:QIZ67043.1	873727	875205	1058.8
NEBC8666	875205_1_876671	S.BsrFII	EnzType:Type I specificity subunit; RecSeq:TTCANNNNNNNCTC; Org#: 691; OrgName: Bacillus stearothermophilus CPW16; Source: Z. Chen; GenBank:CP051162; SeqLength:486; Locus:HF500_07155; ProteinId:QIZ67044.1	875205	876668	979.0
NEBC8666	957531_1_958349	I-TevII	EnzType:homing endonuclease ; RecSeq:GCTTATGAGTATGAAGTGAACACGTTATTC; Org#: 890; OrgName: Bacteriophage T4; Source: M. Belfort; GenBank:Y00122; SeqLength:258; ProteinId:CAA68309.1; UniProt:P07072; GI:15351	958023	958337	16.3
NEBC8666	1004406_1_1006121	Nt.CviQII	EnzType:Type II nicking endonuclease; RecSeq:RAG; Org#: 994; OrgName: Chlorella virus NY-2A; Source: J.L. Van Etten; GenBank:DQ355510; SeqLength:550; ProteinId:ABC86589.1; UniProt:Q0ZLZ5; GI:86129871	1005546	1005893	13.8
NEBC8666	1023441_-1_1023226	C.Esp1396I	EnzType:control protein; RecSeq:ATGTGACTTATAGTCCGTGTGATTATAGTCAACAT; Org#: 4448; OrgName: Enterobacter species RFL1396; Source: A. Janulaitis; GenBank:AF527822; SeqLength:79; ProteinId:AAO16093.1; UniProt:Q8GGH0; GI:27464466	1023435	1023232	16.9
NEBC8666	1054238_-1_1052787	M2.PcaI	EnzType:Type I methyltransferase; RecSeq:GCCNNNNNNTGCG; Org#: 4182; OrgName: Pelobacter carbinolicus; Source: DSM 2380; GenBank:CP000142; SeqLength:708; Locus:Pcar_2925; ProteinId:ABA90160.1; UniProt:Q3A0E7; GI:77546598	1053332	1052964	16.9
NEBC8666	1065394_1_1065840	M.Osp2203I	EnzType:Type I methyltransferase; RecSeq:TGAANNNNRTTG; Org#: 24467; OrgName: Oceanisphaera species AMac2203; Source: H. Sung; GenBank:CP021376; SeqLength:567; Locus:CBP12_10375; ProteinId:ART80493.1; UniProt:A0A1Y0CYT6	1065433	1065714	15.3
NEBC8666	1106159_1_1106344	M.MmuDnmt3A	EnzType:orphan methyltransferase; Org#: 1806; OrgName: Mus musculus; Source: T. Bestor; GenBank:BC007466; SeqLength:908; ProteinId:AAH07466.1; UniProt:O88508; GI:13938621	1106189	1106308	15.3
NEBC8666	1139371_1_1139853	C.BclI	EnzType:control protein; RecSeq:ACTTAAAGTCTGTAGACTTATAGC; Org#: 228; OrgName: Bacillus caldolyticus; Source: A. Atkinson; GenBank:CP025075; SeqLength:77; Locus:CWI35_18055; ProteinId:AUI38376.1; UniProt:E5LGB7	1139392	1139601	22.1
NEBC8666	1167428_1_1168141	M.MjaIV	EnzType:Type II methyltransferase; RecSeq:GTNNAC; Org#: 1713; OrgName: Methanocaldococcus jannaschii DSM 2661; Source: DSM 2661; GenBank:L77117; SeqLength:523	1167560	1167868	17.0
NEBC8666	1178528_1_1179310	M.AauTCI	EnzType:Type II methyltransferase; RecSeq:TTAA; Org#: 4661; OrgName: Arthrobacter aurescens TC1; Source: ATCC BAA-1386; GenBank:CP000474; SeqLength:304; Locus:AAur_2771; ProteinId:ABM06781.1; UniProt:A1R8C0	1178993	1179112	15.9
NEBC8666	1192278_-1_1190941	M.BpaFA6I	EnzType:Type I methyltransferase; RecSeq:GCANNNNNNNNRTRTC; Org#: 35543; OrgName: Bacillus paralicheniformis FA6; Source: D. Zhao; GenBank:CP033198; SeqLength:489; Locus:D2B33_15530; ProteinId:QFY39737.1	1192116	1191712	15.4
NEBC8666	1243762_-1_1242989	EcoKMcrA	EnzType:Type IV methyl-directed restriction enzyme; RecSeq:YCGR; Org#: 1260; OrgName: Escherichia coli K-12 substr. MG1655; Source: F.R. Blattner; GenBank:U00096; SeqLength:277; Locus:b1159; ProteinId:AAC74243.1; UniProt:P24200	1243369	1242995	25.8
NEBC8666	1243762_-1_1242989	SauNewI	EnzType:Type IV methyl-directed restriction enzyme; RecSeq:SCNGS; Org#: 4806; OrgName: Staphylococcus aureus subsp. aureus str. Newman; Source: T. Baba; GenBank:AP009351; SeqLength:953; Locus:NWMN_2386; ProteinId:BAF68658.1; UniProt:A0A0H3KIS6; GI:150375398	1243747	1243397	15.5
NEBC8666	1244291_-1_1243785	BstYI	EnzType:Type II restriction enzyme; RecSeq:RGATCY; Org#: 831; OrgName: Bacillus stearothermophilus Y406; Source: Z. Chen; GenBank:NEBC14842; SeqLength:203	1244150	1243791	33.5
NEBC8672	14276_1_15103	M2.BsmI	EnzType:Type II methyltransferase; RecSeq:GAATGC; Org#: 775; OrgName: Bacillus stearothermophilus NUB36; Source: N. Welker; GenBank:AY079085; SeqLength:270; ProteinId:AAL86023.1; UniProt:Q8RLN5; GI:19347661	14276	15100	244.3
NEBC8672	29857_1_30375	M2.SmoLII	EnzType:Type II methyltransferase; RecSeq:GCAGT; Org#: 5635; OrgName: Streptobacillus moniliformis DSM 12112; Source: DSM 12112; GenBank:CP001779; SeqLength:305; Locus:Smon_1455; ProteinId:ACZ01888.1; UniProt:D1AVX8; GI:268315514	29878	30351	17.6
NEBC8672	33038_1_33823	M.CsaIII	EnzType:Type II methyltransferase; RecSeq:AB, SAAM; Org#: 4330; OrgName: Chromohalobacter salexigens; Source: DSM 3043; GenBank:CP000285; SeqLength:253; Locus:Csal_1401; ProteinId:ABE58756.1; UniProt:Q1QXQ2; GI:91796617	33038	33805	172.1
NEBC8668	175340_-1_174507	M.MspA1I	EnzType:Type II methyltransferase; RecSeq:CMGCKG; Org#: 1800; OrgName: Moraxella species A1; Source: S.K. Degtyarev; GenBank:AY466402; SeqLength:291; ProteinId:AAR30096.1; UniProt:Q6S4U7; GI:39726296	175325	174537	131.2
NEBC8668	179929_-1_179486	C.SptAI	EnzType:control protein; Org#: 4060; OrgName: Salmonella enterica subsp. enterica serovar Paratyphi A str. ATCC 9150; Source: ATCC 9150; GenBank:CP000026; SeqLength:78; Locus:SPA4290; ProteinId:AAV80023.1; UniProt:A0A0H2WVK7; GI:56130517	179923	179714	19.2
NEBC8668	180142_1_180324	C.MunI	EnzType:control protein; RecSeq:GCTTATAGTCCGTTGTTTTTAAAC; Org#: 1824; OrgName: Mycoplasma species; Source: A. Janulaitis; GenBank:X76192; SeqLength:74; ProteinId:CAA53787.1; UniProt:P43640; GI:431929	180142	180297	20.2
NEBC8668	187355_1_187600	M.SsmMI	EnzType:Type II methyltransferase; RecSeq:CTAG; Org#: 6121; OrgName: Spirochaeta smaragdinae DSM 11293; Source: DSM 11293; GenBank:CP002116; SeqLength:352; Locus:Spirs_1835; ProteinId:ADK80961.1; UniProt:E1R6E3	187358	187582	14.7
NEB263	126_1_662	Sse9I	EnzType:Type II restriction enzyme; RecSeq:AATT; Org#: 2337; OrgName: Sporosarcina species 9; Source: S.K. Degtyarev; GenBank:X96789; SeqLength:178; ProteinId:CAK48823.1; UniProt:Q194N8; GI:108936763	126	659	412.4
NEB263	693_1_1781	M.Sse9I	EnzType:Type II methyltransferase; RecSeq:AATT; Org#: 2337; OrgName: Sporosarcina species 9; Source: S.K. Degtyarev; GenBank:X96789; SeqLength:362; ProteinId:CAA65583.1; UniProt:Q56004; GI:1480415	693	1778	803.1
NEBC7814	20246_1_20770	C.BclI	EnzType:control protein; RecSeq:ACTTAAAGTCTGTAGACTTATAGC; Org#: 228; OrgName: Bacillus caldolyticus; Source: A. Atkinson; GenBank:CP025075; SeqLength:77; Locus:CWI35_18055; ProteinId:AUI38376.1; UniProt:E5LGB7	20318	20515	18.2
NEBC7814	46934_-1_45630	SauNewI	EnzType:Type IV methyl-directed restriction enzyme; RecSeq:SCNGS; Org#: 4806; OrgName: Staphylococcus aureus subsp. aureus str. Newman; Source: T. Baba; GenBank:AP009351; SeqLength:953; Locus:NWMN_2386; ProteinId:BAF68658.1; UniProt:A0A0H3KIS6; GI:150375398	46385	45876	26.1
NEBC7814	100656_-1_99703	M.HauIII	EnzType:Type II methyltransferase; RecSeq:CATG; Org#: 4925; OrgName: Herpetosiphon aurantiacus; Source: ATCC 23779; GenBank:CP000875; SeqLength:353; Locus:Haur_0114; ProteinId:ABX02766.1; UniProt:A9B5E1; GI:159889686	100278	99919	14.5
NEBC7814	144506_-1_143769	M.NspI	EnzType:Type II methyltransferase; RecSeq:RCATGY; Org#: 1932; OrgName: Nostoc species C; Source: ATCC 29411; GenBank:AF056036; SeqLength:397; ProteinId:AAC97190.1; UniProt:Q9ZHP3; GI:4033737	144503	144195	14.9
NEBC7814	157098_-1_156451	M.BbrUIII	EnzType:Type II methyltransferase; RecSeq:CTGCAG; Org#: 5698; OrgName: Bifidobacterium breve UCC2003; Source: D. van Sinderen; GenBank:CP000303; SeqLength:467; Locus:Bbr_1119; ProteinId:ABE95797.1; GI:339479329	157059	156535	14.7
NEBC7814	180979_-1_180320	R2.LlaJI	EnzType:Type II restriction enzyme; Org#: 3960; OrgName: Lactococcus lactis; Source: G.F. Fitzgerald; GenBank:DQ534432; SeqLength:414; ProteinId:AAS99180.1; UniProt:Q6QPY9	180979	180359	18.1
NEBC7814	198345_-1_196537	M.CpeAIII	EnzType:Type II methyltransferase; RecSeq:GATC; Org#: 4467; OrgName: Clostridium perfringens ATCC 13124; Source: ATCC 13124; GenBank:CP000246; SeqLength:407; Locus:CPF_1017; ProteinId:ABG83927.1; UniProt:A0A0H2YTQ3	197085	196807	16.3
NEBC7814	353768_-1_352980	FseI	EnzType:Type II restriction enzyme; RecSeq:GGCCGGCC; Org#: 1449; OrgName: Frankia species Eul1b; Source: NRRL 18528; GenBank:JF323049; SeqLength:219; ProteinId:ADX97304.1; UniProt:F1KC51; GI:323650452	353300	352989	23.9
NEBC7814	359321_1_359680	C.EcoO109I	EnzType:control protein; RecSeq:CTAAGNNNNNCTTAG; Org#: 1252; OrgName: Escherichia coli H709c; Source: I. Orskov; GenBank:AF157599; SeqLength:101; ProteinId:AAF06963.1; UniProt:Q9RPJ4; GI:6318606	359321	359548	15.5
