contig	cds	domain	domain_descriptions	start	end	score
NEBC7814	472969_-1_472040	M.Dpi3264I	EnzType:Type I methyltransferase; RecSeq:CTANNNNNNNTGC; Org#: 31103; OrgName: Dolosigranulum pigrum KPL3264; Source: K.P. Lemon; GenBank:CP040410; SeqLength:538; Locus:FE335_02420; ProteinId:PRJNA379818:FE3	472792	472106	36.9
NEBC7814	542596_-1_541904	S.Ppo2020I	EnzType:Type I specificity subunit; RecSeq:CNAGNNNNNTTGK; Org#: 39259; OrgName: Paenibacillus polymyxa 2020; Source: A. Fomenkov; GenBank:CP049598; SeqLength:419; Locus:G7L40_04165; ProteinId:PRJNA609344:G7L	542503	542111	13.9
NEBC7814	575433_1_576008	M.Aba6200I	EnzType:Type I methyltransferase; RecSeq:YACNNNNNGTAG; Org#: 14685; OrgName: Acinetobacter baumannii 6200; Source: J. McCorrison; GenBank:CP010397; SeqLength:552; Locus:RU84_11935; ProteinId:AJB67554.1; GI:743002134	575472	575906	14.6
NEBC7814	612898_-1_612137	M.Eco47II	EnzType:Type II methyltransferase; RecSeq:GGNCC; Org#: 1359; OrgName: Escherichia coli RFL47; Source: A. Janulaitis; GenBank:X82105; SeqLength:417; ProteinId:CAA57629.1; UniProt:P50196; GI:558571	612898	612716	19.6
NEBC7814	650196_1_652046	S.Aba6411I	EnzType:Type I specificity subunit; RecSeq:CCANNNNNNNNTGG; Org#: 14677; OrgName: Acinetobacter baumannii 6411; Source: J. McCorrison; GenBank:CP010368; SeqLength:407; Locus:RR32_13630; ProteinId:AJB49107.1; GI:742929052	651690	651968	16.3
NEBC7814	685626_-1_685426	C.BclI	EnzType:control protein; RecSeq:ACTTAAAGTCTGTAGACTTATAGC; Org#: 228; OrgName: Bacillus caldolyticus; Source: A. Atkinson; GenBank:CP025075; SeqLength:77; Locus:CWI35_18055; ProteinId:AUI38376.1; UniProt:E5LGB7	685626	685432	24.8
NEBC7814	690575_1_690952	C.BclI	EnzType:control protein; RecSeq:ACTTAAAGTCTGTAGACTTATAGC; Org#: 228; OrgName: Bacillus caldolyticus; Source: A. Atkinson; GenBank:CP025075; SeqLength:77; Locus:CWI35_18055; ProteinId:AUI38376.1; UniProt:E5LGB7	690674	690880	22.0
NEBC7814	691965_-1_691105	M.BceSVII	EnzType:Type II methyltransferase; RecSeq:AB; Org#: 244; OrgName: Bacillus cereus ATCC 10987; Source: ATCC 10987; GenBank:AE017194; SeqLength:413; Locus:BCE_0392; ProteinId:AAS39328.1; UniProt:Q73EG6; GI:42735389	691662	691357	16.8
NEBC7814	753080_1_753697	I-HmuII	EnzType:homing endonuclease ; RecSeq:ATTATTCCAGTATAACTTTGAGATTAAG; Org#: 856; OrgName: Bacillus subtilis bacteriophage SP82; Source: D.A. Shub; GenBank:U04812; SeqLength:185; ProteinId:AAA56884.1; UniProt:Q38137; GI:495453	753416	753616	21.9
NEBC7814	771875_-1_770379	EcoKMcrBC	(EcoKMcrB) EnzType:Type IV methyl-directed restriction enzyme; Org#: 1260; OrgName: Escherichia coli K-12 substr. MG1655; Source: F.R. Blattner; GenBank:U00096; SeqLength:459; Locus:b4346; ProteinId:AAC77302.2; UniProt:P15005	771122	770559	100.1
NEBC7814	771875_-1_770379	EcoKMcrBC	(EcoKMcrB) EnzType:Type IV methyl-directed restriction enzyme; Org#: 1260; OrgName: Escherichia coli K-12 substr. MG1655; Source: F.R. Blattner; GenBank:U00096; SeqLength:459; Locus:b4346; ProteinId:AAC77302.2; UniProt:P15005	771758	771510	22.3
NEBC7814	785261_-1_784713	C.MunI	EnzType:control protein; RecSeq:GCTTATAGTCCGTTGTTTTTAAAC; Org#: 1824; OrgName: Mycoplasma species; Source: A. Janulaitis; GenBank:X76192; SeqLength:74; ProteinId:CAA53787.1; UniProt:P43640; GI:431929	785261	785058	33.4
NEBC7814	789251_1_790279	M2.BfuAI	EnzType:Type II methyltransferase; RecSeq:ACCTGC; Org#: 281; OrgName: Bacillus fusiformis 1083; Source: NEB 1292; GenBank:CP070490; SeqLength:342; Locus:JTI58_04000; ProteinId:PRJNA622823:JTI	789251	790276	790.9
NEBC7814	790280_1_791353	M1.BfuAI	EnzType:Type II methyltransferase; RecSeq:ACCTGC; Org#: 281; OrgName: Bacillus fusiformis 1083; Source: NEB 1292; GenBank:CP070490; SeqLength:357; Locus:JTI58_04005; ProteinId:PRJNA622823:JTI	790280	791350	813.6
NEBC7814	792912_-1_791416	BfuAI	EnzType:Type II restriction enzyme; RecSeq:ACCTGC; Org#: 281; OrgName: Bacillus fusiformis 1083; Source: NEB 1292; GenBank:CP070490; SeqLength:486; Locus:JTI58_04010; ProteinId:PRJNA622823:JTI	792876	791419	1103.8
NEBC7814	794000_-1_793776	C.BclI	EnzType:control protein; RecSeq:ACTTAAAGTCTGTAGACTTATAGC; Org#: 228; OrgName: Bacillus caldolyticus; Source: A. Atkinson; GenBank:CP025075; SeqLength:77; Locus:CWI35_18055; ProteinId:AUI38376.1; UniProt:E5LGB7	794000	793797	15.6
NEBC7814	819542_-1_818304	M.Esp375I	EnzType:Type I methyltransferase; RecSeq:GAYNNNNNNCTTA; Org#: 26820; OrgName: Enterococcus species FDAARGOS_375; Source: H. Sichtig; GenBank:CP023514; SeqLength:537; Locus:CO692_00165; ProteinId:ATF70596.1; UniProt:A0A291DHL8	818825	818487	14.9
NEBC7814	882450_1_883430	S.SbaUIII	EnzType:Type I specificity subunit; RecSeq:CCGANNNNNGTC; Org#: 9142; OrgName: Salmonella enterica subs. enterica serovar Bareilly CFSAN000189; Source: D. Roberson; GenBank:CP039502; SeqLength:464; Locus:SEEB0189_20055; ProteinId:QCF23367.1; UniProt:A0A4D6PDP7	882768	883217	14.3
NEBC7814	986418_-1_985345	V.MthTI	EnzType:Type II nicking endonuclease; Org#: 1707; OrgName: Methanobacterium thermoformicicum THF; Source: DSM 3848; GenBank:X68366; SeqLength:221; ProteinId:CAA48433.1; UniProt:P29588; GI:809723	986382	985744	132.4
NEBC7814	1033543_-1_1032890	S.Asp19306I	EnzType:Type I specificity subunit; RecSeq:GGANNNNNNNTTGY; Org#: 35514; OrgName: Agromyces species KACC 19306; Source: J. Heo; GenBank:CP043505; SeqLength:364; Locus:FLP10_04730; ProteinId:QEO13805.1; UniProt:A0A5C1YED7	1033192	1032971	19.3
NEBC7814	1033543_-1_1032890	S.Sen315I	EnzType:Type I specificity subunit; RecSeq:TAAGNNNNNTTC; Org#: 22598; OrgName: Salmonella enterica subsp. enterica serovar Muenster 0315; Source: E.A. Strain; GenBank:CP019198; SeqLength:478; Locus:SEEM0315_021495; ProteinId:APW17096.1; GI:113248821	1033420	1033142	14.2
NEBC7814	1033758_1_1034147	C.AhdI	EnzType:control protein; RecSeq:ACTCATAGTCCGTGGACTTATCGA; Org#: 107; OrgName: Aeromonas hydrophila; Source: NEB 724; GenBank:CP050994; SeqLength:74; Locus:HFP99_10565; ProteinId:QIY87049.1; UniProt:Q7X0F0	1033758	1033970	35.2
NEBC7814	1033758_1_1034147	M.Msy25204I	EnzType:Type II methyltransferase; RecSeq:GATC; Org#: 15392; OrgName: Mycoplasma synoviae ATCC 25204 WVU1853; Source: ATCC 25204; GenBank:CP011096; SeqLength:345; Locus:VY93_01015; ProteinId:AKB10962.1; UniProt:A0A8D3YIZ1; GI:805300833	1033767	1034132	25.7
NEBC7814	1182861_-1_1181827	S.Sau64038I	EnzType:Type I specificity subunit; RecSeq:ACCNNNNNRTGA; Org#: 28821; OrgName: Staphylococcus aureus CFSAN064038; Source: M. Hoffmann; GenBank:CP028163; SeqLength:392; Locus:C9J77_00065; ProteinId:AVR99449.1	1182687	1182199	17.4
NEBC7814	1239422_-1_1237956	SauNewI	EnzType:Type IV methyl-directed restriction enzyme; RecSeq:SCNGS; Org#: 4806; OrgName: Staphylococcus aureus subsp. aureus str. Newman; Source: T. Baba; GenBank:AP009351; SeqLength:953; Locus:NWMN_2386; ProteinId:BAF68658.1; UniProt:A0A0H3KIS6; GI:150375398	1238870	1238415	20.4
NEBC7814	1258696_-1_1257818	BsmBI	EnzType:Type II restriction enzyme; RecSeq:CGTCTC; Org#: 674; OrgName: Bacillus stearothermophilus B61; Source: NEB 857; GenBank:AY452068; SeqLength:530; ProteinId:AAS09914.1; UniProt:Q69B20; GI:41584551	1258147	1257821	15.6
NEBC7814	1528018_-1_1527341	C.BglII	EnzType:control protein; RecSeq:ACTTATAGTCCGTGGACACATAGT; Org#: 283; OrgName: Bacillus globigii; Source: ATCC 49760; GenBank:CP014840; SeqLength:77; Locus:A1D11_20265; ProteinId:AMR64578.1; UniProt:A0A7Z9E677; GI:100929148	1527562	1527350	20.6
NEBC7814	1557774_1_1558166	M.Eco47II	EnzType:Type II methyltransferase; RecSeq:GGNCC; Org#: 1359; OrgName: Escherichia coli RFL47; Source: A. Janulaitis; GenBank:X82105; SeqLength:417; ProteinId:CAA57629.1; UniProt:P50196; GI:558571	1557777	1557941	13.7
NEBC7814	1653494_-1_1651026	EcoKMcrBC	(EcoKMcrB) EnzType:Type IV methyl-directed restriction enzyme; Org#: 1260; OrgName: Escherichia coli K-12 substr. MG1655; Source: F.R. Blattner; GenBank:U00096; SeqLength:459; Locus:b4346; ProteinId:AAC77302.2; UniProt:P15005	1651868	1651530	20.9
NEBC7814	1673265_1_1673471	S.Bsp21507I	EnzType:Type I specificity subunit; RecSeq:CGANNNNNNNRTTT; Org#: 37947; OrgName: Bombella species KACC 21507; Source: J. Heo; GenBank:CP047652; SeqLength:384; Locus:GT348_00215	1673283	1673462	14.6
NEBC7814	1704693_1_1706447	S.Cgl56828I	EnzType:Type I specificity subunit; RecSeq:CTGANNNNNCTG; Org#: 17976; OrgName: Corynebacterium glutamicum USDA-ARS-USMARC-56828; Source: G.P. Harhay; GenBank:CP014329; SeqLength:403; Locus:APT58_15290; ProteinId:AMK79455.1; UniProt:A0A140E7T1; GI:998908063	1705524	1706075	18.5
NEBC7814	1755447_-1_1754872	ZmoCP4Mrr	EnzType:Type IV methyl-directed restriction enzyme; Org#: 4854; OrgName: Zymomonas mobilis subs. mobilis var recifensis CP4/D; Source: L.O. Ingram; GenBank:EU327527; SeqLength:307; ProteinId:ABY40736.1; UniProt:A9Z0S5; GI:163717524	1755447	1754875	189.3
NEBC7814	1755796_-1_1755455	ZmoCP4Mrr	EnzType:Type IV methyl-directed restriction enzyme; Org#: 4854; OrgName: Zymomonas mobilis subs. mobilis var recifensis CP4/D; Source: L.O. Ingram; GenBank:EU327527; SeqLength:307; ProteinId:ABY40736.1; UniProt:A9Z0S5; GI:163717524	1755781	1755473	42.9
NEBC7814	1765896_-1_1764988	M.SphI	EnzType:Type II methyltransferase; RecSeq:GCATGC; Org#: 2481; OrgName: Streptomyces phaeochromogenes; Source: NRRL B-3559; GenBank:U33216; SeqLength:316; ProteinId:AAB40377.1; UniProt:P95820; GI:1773269	1765896	1765027	234.2
NEBC7814	1766006_1_1766761	SphI	EnzType:Type II restriction enzyme; RecSeq:GCATGC; Org#: 2481; OrgName: Streptomyces phaeochromogenes; Source: NRRL B-3559; GenBank:U33216; SeqLength:235; ProteinId:AAB40378.1; UniProt:P95821; GI:1773270	1766048	1766749	166.6
NEBC7814	1793607_-1_1792759	M.McaTII	EnzType:Type II methyltransferase; RecSeq:AB; Org#: 4003; OrgName: Methylococcus capsulatus str. Bath; Source: ATCC 33009; GenBank:AE017282; SeqLength:421; Locus:MCA2655; ProteinId:AAU91221.1; UniProt:Q603Z1; GI:53756930	1793529	1793185	17.8
NEBC7814	1795484_-1_1794585	M.BceSVII	EnzType:Type II methyltransferase; RecSeq:AB; Org#: 244; OrgName: Bacillus cereus ATCC 10987; Source: ATCC 10987; GenBank:AE017194; SeqLength:413; Locus:BCE_0392; ProteinId:AAS39328.1; UniProt:Q73EG6; GI:42735389	1795385	1795092	16.6
NEBC7814	1847222_1_1848148	S.VvuCMCP6I	EnzType:Type I specificity subunit; RecSeq:GGANNNNNNNNNTGGC; Org#: 34407; OrgName: Vibrio vulnificus CMCP6; Source: J.W. Conrad; GenBank:CP037931; SeqLength:560; Locus:E2I22_11155; ProteinId:QBN14618.1	1847561	1847887	14.0
NEBC7814	1868316_1_1869065	M.SdeAIV	EnzType:Type II methyltransferase; RecSeq:GTMKAC; Org#: 4197; OrgName: Sulfurimonas denitrificans DSM 1251; Source: DSM 1251; GenBank:CP000153; SeqLength:533; Locus:Suden_0129; ProteinId:ABB43410.1; UniProt:Q30UC1; GI:78496870	1868346	1868828	23.0
NEBC7814	1876159_1_1877043	M.Csp68KII	EnzType:Type II methyltransferase; RecSeq:TTCGAA; Org#: 1102; OrgName: Cyanothece species BH68K; Source: ATCC 51142; GenBank:CP000806; SeqLength:472; Locus:cce_2280; ProteinId:ACB51630.1; UniProt:B1WPR0; GI:171698649	1876228	1876656	18.2
NEBC7814	1959491_1_1960108	M.Tsp2319I	EnzType:Type II methyltransferase; RecSeq:GCNNNNNNNGC; Org#: 17910; OrgName: Thermococcus species 2319x1; Source: S. Gavrilovan; GenBank:CP012200; SeqLength:677; Locus:ADU37_CDS02960; ProteinId:ALV61995.1; UniProt:A0A0U3S6H7; GI:971361823	1959629	1960036	13.7
NEBC7814	2093633_1_2094637	SgeI	EnzType:Type II methyl-directed restriction enzyme; RecSeq:CNNG; Org#: 5474; OrgName: Streptomyces griseoflavus RFL11; Source: A. Janulaitis; GenBank:GU827554; SeqLength:434; ProteinId:ADK78993.1; UniProt:G4V423; GI:301557996	2093966	2094232	15.6
NEBC7814	2112576_1_2112887	C.BclI	EnzType:control protein; RecSeq:ACTTAAAGTCTGTAGACTTATAGC; Org#: 228; OrgName: Bacillus caldolyticus; Source: A. Atkinson; GenBank:CP025075; SeqLength:77; Locus:CWI35_18055; ProteinId:AUI38376.1; UniProt:E5LGB7	2112627	2112854	41.7
NEBC7814	2119021_1_2120559	EcoKMcrA	EnzType:Type IV methyl-directed restriction enzyme; RecSeq:YCGR; Org#: 1260; OrgName: Escherichia coli K-12 substr. MG1655; Source: F.R. Blattner; GenBank:U00096; SeqLength:277; Locus:b1159; ProteinId:AAC74243.1; UniProt:P24200	2120134	2120382	18.0
NEBC7814	2131845_1_2132726	M.TmeBIV	EnzType:Type III methyltransferase; RecSeq:CGCC; Org#: 4791; OrgName: Thermosipho melanesiensis BI429; Source: DSM 12029; GenBank:CP000716; SeqLength:846; Locus:Tmel_1691; ProteinId:ABR31533.1; UniProt:A6LNN2; GI:149794085	2132427	2132690	14.3
NEBC7814	2132704_1_2133654	M2.LlaUC11I	EnzType:Type II methyltransferase; RecSeq:GCATC; Org#: 20819; OrgName: Lactococcus lactis subsp. lactis strain UC11; Source: D. van Sinderen; GenBank:CP016721; SeqLength:398; Locus:LLUC11_pB47; ProteinId:ARE12291.1	2133127	2133606	16.5
NEBC7814	2193310_-1_2192858	C.MunI	EnzType:control protein; RecSeq:GCTTATAGTCCGTTGTTTTTAAAC; Org#: 1824; OrgName: Mycoplasma species; Source: A. Janulaitis; GenBank:X76192; SeqLength:74; ProteinId:CAA53787.1; UniProt:P43640; GI:431929	2193307	2193122	20.7
NEBC7814	2419261_1_2420121	M.MfoCT6III	EnzType:Type II methyltransferase; RecSeq:ATCGAT; Org#: 12934; OrgName: Mycobacterium fortuitum CT6; Source: K. Costa; GenBank:CP011269; SeqLength:581; Locus:XA26_21390; ProteinId:ALI25984.1; UniProt:A0A0N9XQH2; GI:937419985	2419528	2420067	21.8
NEBC7814	2546811_1_2547401	S.CjeFII	EnzType:Type I specificity subunit; RecSeq:AGTNNNNNNRTTG; Org#: 3414; OrgName: Campylobacter jejuni strain 81-176; Source: R.E. Mandrell; GenBank:CP000538; SeqLength:422; Locus:CJJ81176_0777; ProteinId:EAQ72327.1; UniProt:Q0Q7K5	2546931	2547245	14.9
NEBC7814	2576755_1_2578734	EcoEI	EnzType:Type I restriction enzyme; RecSeq:GAGNNNNNNNATGC; Org#: 1226; OrgName: Escherichia coli A58; Source: N.E. Murray; GenBank:NEBM62; SeqLength:813; ProteinId:AAD15048.1; UniProt:Q47281; GI:304896	2576761	2577018	17.1
NEBC7814	2576755_1_2578734	ScoA3I	EnzType:Type IV methyl-directed restriction enzyme; Org#: 2434; OrgName: Streptomyces coelicolor A3(2); Source: D.A. Hopwood; GenBank:AL645882; SeqLength:945; ProteinId:CAB65593.1; UniProt:Q9RD88; GI:6689196	2578018	2578497	25.9
NEBC7814	2592964_1_2593515	C.BclI	EnzType:control protein; RecSeq:ACTTAAAGTCTGTAGACTTATAGC; Org#: 228; OrgName: Bacillus caldolyticus; Source: A. Atkinson; GenBank:CP025075; SeqLength:77; Locus:CWI35_18055; ProteinId:AUI38376.1; UniProt:E5LGB7	2592967	2593176	25.3
NEBC7814	2731574_-1_2731032	C.BamHI	EnzType:control protein; RecSeq:ACTTATAGTCTGTAGCCTATAGTC; Org#: 208; OrgName: Bacillus amyloliquefaciens H; Source: ATCC 49763; GenBank:CP041693; SeqLength:81; Locus:FOG69_16000; ProteinId:QDP93515.1	2731574	2731365	32.1
NEBC7814	2825333_1_2825899	M.Csp231I	EnzType:Type II methyltransferase; RecSeq:AAGCTT; Org#: 4326; OrgName: Citrobacter species RFL231; Source: T. Kaczorowski; GenBank:AY787793; SeqLength:301; ProteinId:AAX19734.1; UniProt:Q32WH2; GI:60418614	2825366	2825620	20.3
NEBC7814	2895901_1_2896518	M.Csp68KV	EnzType:orphan methyltransferase; RecSeq:GGCC; Org#: 1102; OrgName: Cyanothece species BH68K; Source: ATCC 51142; GenBank:CP000806; SeqLength:285; Locus:cce_1061; ProteinId:ACB50412.1; UniProt:B1WTU6; GI:171697431	2896015	2896452	14.8
NEBC7814	2956195_1_2957595	EcoKMcrBC	(EcoKMcrB) EnzType:Type IV methyl-directed restriction enzyme; Org#: 1260; OrgName: Escherichia coli K-12 substr. MG1655; Source: F.R. Blattner; GenBank:U00096; SeqLength:459; Locus:b4346; ProteinId:AAC77302.2; UniProt:P15005	2956282	2956488	16.2
NEBC7814	3340644_-1_3340303	I-BmoI	EnzType:homing endonuclease ; RecSeq:GAGTAAGAGCCCGTAGTAATGACATGGC; Org#: 3227; OrgName: Bacillus mojavensis s87-18; Source: D.A. Shub; GenBank:AF321518; SeqLength:266; ProteinId:AAK09365.1; UniProt:Q9ANR6; GI:12958590	3340599	3340330	31.8
NEBC7814	3364846_1_3366288	SauNewI	EnzType:Type IV methyl-directed restriction enzyme; RecSeq:SCNGS; Org#: 4806; OrgName: Staphylococcus aureus subsp. aureus str. Newman; Source: T. Baba; GenBank:AP009351; SeqLength:953; Locus:NWMN_2386; ProteinId:BAF68658.1; UniProt:A0A0H3KIS6; GI:150375398	3365485	3366129	19.2
NEBC7814	3507072_1_3507695	V.MthTI	EnzType:Type II nicking endonuclease; Org#: 1707; OrgName: Methanobacterium thermoformicicum THF; Source: DSM 3848; GenBank:X68366; SeqLength:221; ProteinId:CAA48433.1; UniProt:P29588; GI:809723	3507075	3507665	69.8
NEBC7814	3687544_-1_3686294	C.SptAI	EnzType:control protein; Org#: 4060; OrgName: Salmonella enterica subsp. enterica serovar Paratyphi A str. ATCC 9150; Source: ATCC 9150; GenBank:CP000026; SeqLength:78; Locus:SPA4290; ProteinId:AAV80023.1; UniProt:A0A0H2WVK7; GI:56130517	3687538	3687347	20.1
NEBC7814	3730887_1_3731105	C.BamHI	EnzType:control protein; RecSeq:ACTTATAGTCTGTAGCCTATAGTC; Org#: 208; OrgName: Bacillus amyloliquefaciens H; Source: ATCC 49763; GenBank:CP041693; SeqLength:81; Locus:FOG69_16000; ProteinId:QDP93515.1	3730896	3731096	19.4
NEBC7814	3755062_-1_3754340	M.HauIII	EnzType:Type II methyltransferase; RecSeq:CATG; Org#: 4925; OrgName: Herpetosiphon aurantiacus; Source: ATCC 23779; GenBank:CP000875; SeqLength:353; Locus:Haur_0114; ProteinId:ABX02766.1; UniProt:A9B5E1; GI:159889686	3754999	3754649	16.0
NEBC7814	3793984_-1_3793220	M.BspHI	EnzType:Type II methyltransferase; RecSeq:TCATGA; Org#: 398; OrgName: Bacillus species H; Source: NEB 394; GenBank:CP055283; SeqLength:411; Locus:HUK62_17160; ProteinId:QKY92182.1; UniProt:A0A7H8SLI8	3793972	3793673	17.6
NEBC7814	3816727_1_3816951	M.CfrBI	EnzType:Type II methyltransferase; RecSeq:CCWWGG; Org#: 1009; OrgName: Citrobacter freundii 4111; Source: A.S. Solonin; GenBank:X57945; SeqLength:376; ProteinId:CAA41012.1; UniProt:Q04845; GI:40477	3816730	3816885	15.6
NEBC7814	3902783_-1_3902280	C.BamHI	EnzType:control protein; RecSeq:ACTTATAGTCTGTAGCCTATAGTC; Org#: 208; OrgName: Bacillus amyloliquefaciens H; Source: ATCC 49763; GenBank:CP041693; SeqLength:81; Locus:FOG69_16000; ProteinId:QDP93515.1	3902738	3902535	18.6
NEBC7814	3910806_1_3911087	CjeNIII	(RM.CjeNIII) EnzType:Type IIG restriction enzyme/methyltransferase; RecSeq:GKAAYG; Org#: 951; OrgName: Campylobacter jejuni 11168; Source: NCTC 11168; GenBank:AL111168; SeqLength:1250; Locus:Cj0690c; ProteinId:CAL34827.1; UniProt:Q0PAI9; GI:112360035	3910821	3911072	14.2
NEBC7814	3941047_1_3941466	M.TvoDam	EnzType:Type II methyltransferase; RecSeq:GATC; Org#: 3192; OrgName: Thermoplasma volcanium GSS1; Source: M. Suzuki; GenBank:BA000011; SeqLength:277; ProteinId:BAB60005.1; UniProt:Q97AE7; GI:14325080	3941047	3941247	16.5
NEBC7814	3977191_1_3977787	M.Dac11109I	EnzType:Type III methyltransferase; RecSeq:GACGA; Org#: 6881; OrgName: Desulfobacca acetoxidans DSM 11109; Source: DSM 11109; GenBank:CP002629; SeqLength:616; Locus:Desac_2433; ProteinId:AEB10254.1; UniProt:F2NDH8; GI:328454425	3977197	3977544	14.2
NEBC7814	4042245_-1_4041907	S.Bae232I	EnzType:Type I specificity subunit; RecSeq:GAAYNNNNNNTNGC; Org#: 33168; OrgName: Bacillus aerophilus 232; Source: M.-K. Park; GenBank:CP026008; SeqLength:410; Locus:BAE_01570; ProteinId:QAR51557.1	4042245	4042003	14.8
NEBC7814	4046753_1_4047541	M.Mru1279VI	EnzType:Type II methyltransferase; RecSeq:TTAA; Org#: 141; OrgName: Meiothermus ruber DSM 1279; Source: DSM 1279; GenBank:CP005385; SeqLength:286; Locus:K649_14995; ProteinId:AGK06285.1; UniProt:D3PS42	4047230	4047385	15.7
NEBC7814	4121494_-1_4121273	C.BamHI	EnzType:control protein; RecSeq:ACTTATAGTCTGTAGCCTATAGTC; Org#: 208; OrgName: Bacillus amyloliquefaciens H; Source: ATCC 49763; GenBank:CP041693; SeqLength:81; Locus:FOG69_16000; ProteinId:QDP93515.1	4121491	4121285	19.2
NEBC7814	4125249_1_4125500	M1.BbvCI	EnzType:Type II methyltransferase; RecSeq:CCTCAGC; Org#: 225; OrgName: Bacillus brevis; Source: NEB 1030; GenBank:NEBC14584; SeqLength:429	4125252	4125482	14.3
NEBC7814	4287287_1_4287859	C.BclI	EnzType:control protein; RecSeq:ACTTAAAGTCTGTAGACTTATAGC; Org#: 228; OrgName: Bacillus caldolyticus; Source: A. Atkinson; GenBank:CP025075; SeqLength:77; Locus:CWI35_18055; ProteinId:AUI38376.1; UniProt:E5LGB7	4287305	4287538	30.2
NEBC7814	4297615_-1_4297412	M.KspG5Dam	EnzType:orphan methyltransferase; Org#: 17631; OrgName: Klebsiella species G5; Source: K.-G. Chan; GenBank:CP012871; SeqLength:277; Locus:AO703_19685; ProteinId:ALR78414.1; UniProt:A0A806X927	4297612	4297427	15.3
NEBC7814	4342831_1_4343391	M.Msy25204I	EnzType:Type II methyltransferase; RecSeq:GATC; Org#: 15392; OrgName: Mycoplasma synoviae ATCC 25204 WVU1853; Source: ATCC 25204; GenBank:CP011096; SeqLength:345; Locus:VY93_01015; ProteinId:AKB10962.1; UniProt:A0A8D3YIZ1; GI:805300833	4342831	4343352	27.6
NEBC7814	4362564_-1_4361848	M1.MnlI	EnzType:Type II methyltransferase; RecSeq:CCTC; Org#: 1791; OrgName: Moraxella nonliquefaciens; Source: ATCC 17953; GenBank:AY615524; SeqLength:351; ProteinId:AAU87368.1; UniProt:Q538B4; GI:52788777	4362480	4362115	15.4
NEBC7814	4542541_-1_4542218	C.SptAI	EnzType:control protein; Org#: 4060; OrgName: Salmonella enterica subsp. enterica serovar Paratyphi A str. ATCC 9150; Source: ATCC 9150; GenBank:CP000026; SeqLength:78; Locus:SPA4290; ProteinId:AAV80023.1; UniProt:A0A0H2WVK7; GI:56130517	4542508	4542305	16.4
NEBC7814	4544756_-1_4544520	C.BclI	EnzType:control protein; RecSeq:ACTTAAAGTCTGTAGACTTATAGC; Org#: 228; OrgName: Bacillus caldolyticus; Source: A. Atkinson; GenBank:CP025075; SeqLength:77; Locus:CWI35_18055; ProteinId:AUI38376.1; UniProt:E5LGB7	4544753	4544553	20.4
NEBC7814	4544914_1_4545276	C.EcoO109I	EnzType:control protein; RecSeq:CTAAGNNNNNCTTAG; Org#: 1252; OrgName: Escherichia coli H709c; Source: I. Orskov; GenBank:AF157599; SeqLength:101; ProteinId:AAF06963.1; UniProt:Q9RPJ4; GI:6318606	4544914	4545153	27.6
NEBC7814	4545450_1_4545812	C.SptAI	EnzType:control protein; Org#: 4060; OrgName: Salmonella enterica subsp. enterica serovar Paratyphi A str. ATCC 9150; Source: ATCC 9150; GenBank:CP000026; SeqLength:78; Locus:SPA4290; ProteinId:AAV80023.1; UniProt:A0A0H2WVK7; GI:56130517	4545453	4545650	15.7
NEBC7814	4546135_1_4548114	EcoAI	EnzType:Type I restriction enzyme; RecSeq:GAGNNNNNNNGTCA; Org#: 1218; OrgName: Escherichia coli 15T-; Source: T.A. Bickle; GenBank:NEBM55; SeqLength:810	4546255	4546893	47.5
NEBC7814	4546135_1_4548114	ScoA3I	EnzType:Type IV methyl-directed restriction enzyme; Org#: 2434; OrgName: Streptomyces coelicolor A3(2); Source: D.A. Hopwood; GenBank:AL645882; SeqLength:945; ProteinId:CAB65593.1; UniProt:Q9RD88; GI:6689196	4546522	4547736	64.8
NEBC7814	4685725_1_4686258	S.Ali4189I	EnzType:Type I specificity subunit; RecSeq:GAANNNNNNNRTGG; Org#: 39192; OrgName: Actinobacillus lignieresii NCTC4189; Source: S. Doyle; GenBank:UFRM01000001; SeqLength:384; Locus:NCTC4189_01000; ProteinId:SUT97869.1	4685740	4686246	14.3
NEBC7814	4718104_1_4719003	M.Eco47II	EnzType:Type II methyltransferase; RecSeq:GGNCC; Org#: 1359; OrgName: Escherichia coli RFL47; Source: A. Janulaitis; GenBank:X82105; SeqLength:417; ProteinId:CAA57629.1; UniProt:P50196; GI:558571	4718110	4718328	20.0
NEBC7814	4800657_-1_4799863	M.Eco47II	EnzType:Type II methyltransferase; RecSeq:GGNCC; Org#: 1359; OrgName: Escherichia coli RFL47; Source: A. Janulaitis; GenBank:X82105; SeqLength:417; ProteinId:CAA57629.1; UniProt:P50196; GI:558571	4800657	4800475	13.7
NEBC7814	4849679_-1_4849125	C.SptAI	EnzType:control protein; Org#: 4060; OrgName: Salmonella enterica subsp. enterica serovar Paratyphi A str. ATCC 9150; Source: ATCC 9150; GenBank:CP000026; SeqLength:78; Locus:SPA4290; ProteinId:AAV80023.1; UniProt:A0A0H2WVK7; GI:56130517	4849676	4849464	37.4
NEBC7814	4929149_-1_4928943	C.AhdI	EnzType:control protein; RecSeq:ACTCATAGTCCGTGGACTTATCGA; Org#: 107; OrgName: Aeromonas hydrophila; Source: NEB 724; GenBank:CP050994; SeqLength:74; Locus:HFP99_10565; ProteinId:QIY87049.1; UniProt:Q7X0F0	4929149	4928967	24.0
NEBC7814	4938635_-1_4937754	I-Bth0305I	EnzType:homing endonuclease ; RecSeq:ATGTAAACTCACGCTTCGGTGATCCAAACGTGACAACTG; Org#: 7980; OrgName: Bacillus thuringiensis bacteriophage 0305phi8-36; Source: P. Serwer; GenBank:EF583821; SeqLength:266; Locus:0305phi8-36p029; ProteinId:ABS83813.1; UniProt:A7KV39; GI:154622933	4938176	4937763	18.8
HQ446233	4_1_1464	BfuAI	EnzType:Type II restriction enzyme; RecSeq:ACCTGC; Org#: 281; OrgName: Bacillus fusiformis 1083; Source: NEB 1292; GenBank:CP070490; SeqLength:486; Locus:JTI58_04010; ProteinId:PRJNA622823:JTI	4	1461	1103.9
HQ446233	2600_-1_1527	M1.BfuAI	EnzType:Type II methyltransferase; RecSeq:ACCTGC; Org#: 281; OrgName: Bacillus fusiformis 1083; Source: NEB 1292; GenBank:CP070490; SeqLength:357; Locus:JTI58_04005; ProteinId:PRJNA622823:JTI	2600	1530	813.6
HQ446233	3629_-1_2601	M2.BfuAI	EnzType:Type II methyltransferase; RecSeq:ACCTGC; Org#: 281; OrgName: Bacillus fusiformis 1083; Source: NEB 1292; GenBank:CP070490; SeqLength:342; Locus:JTI58_04000; ProteinId:PRJNA622823:JTI	3629	2604	790.9
NEBC1897	449_-1_3	M.HhaI	EnzType:Type II methyltransferase; RecSeq:GCGC; Org#: 1478; OrgName: Haemophilus haemolyticus; Source: ATCC 10014; GenBank:CP038817; SeqLength:327; Locus:E5Q53_07175	449	150	64.8
NEB223	319_1_2373	M.XmnI	EnzType:Type II methyltransferase; RecSeq:GAANNNNTTC; Org#: 3077; OrgName: Xanthomonas manihotis 7AS1; Source: ATCC 49764; GenBank:U44748; SeqLength:620; ProteinId:AAC44403.1; UniProt:Q56788; GI:1209820	739	1857	85.3
NEB223	319_1_2373	S.AspRAC06I	EnzType:Type I specificity subunit; RecSeq:CACNNNNNNGTCY; Org#: 19993; OrgName: Agrobacterium species RAC06; Source: K.R. Fixen; GenBank:CP016499; SeqLength:393; Locus:BSY240_555; ProteinId:AOG11819.1; UniProt:A0A1B3P2J1; GI:105951904	1777	2346	78.0
NEB246	81_1_3185	BpmI	(RM.BpmI) EnzType:Type IIG restriction enzyme/methyltransferase; RecSeq:CTGGAG; Org#: 339; OrgName: Bacillus pumilus; Source: NEB 711; GenBank:AF522187; SeqLength:1009; ProteinId:AAM81323.1; UniProt:Q8KRW6; GI:21914203	102	3170	292.0
NEB246	3200_1_5116	M.SfcI	EnzType:Type II methyltransferase; RecSeq:CTRYAG; Org#: 2381; OrgName: Streptococcus faecium; Source: NEB 674; GenBank:JF432058; SeqLength:606; ProteinId:ADZ31420.1; UniProt:F1KM45; GI:325564132	3293	5101	287.5
